arg1,arg2,relation,connective,type,original_utt,original_utt_prev
"the disco was kind of funny, but i liked this movie ","of this really great song, strawberry fields forever.",contingency,because,mid,"the disco was kind of funny, but i liked this movie because of this really great song, strawberry fields forever.","I think they are great singers, and I liked this better than their disco."
its wierd these songs are so old ,people still love them,comparison,but,mid,its wierd these songs are so old but people still love them,In 1968 i think
"not only is the music great, ",the art is fantastic as well.,comparison,but,mid,"mine too! not only is the music great, but the art is fantastic as well.",That sounds awesome. The Sgt. Pepper album is one of my favorites.
"i love ""lucy in the sky with diamonds""; ","i also love ""when i'm sixty-four"", ""lovely rita"", and ""being for the benefit of mr. kite"", too.",comparison,but,mid,"i love ""lucy in the sky with diamonds""; but i also love ""when i'm sixty-four"", ""lovely rita"", and ""being for the benefit of mr. kite"", too. it's too hard to pick.",I love the concept behind it. What's your favorite track on the album?
"i love ""lucy in the sky with diamonds""; but i also love ""when i'm sixty-four"", ""lovely rita"", ","""being for the benefit of mr. kite"", too.",expansion,and,mid,"i love ""lucy in the sky with diamonds""; but i also love ""when i'm sixty-four"", ""lovely rita"", and ""being for the benefit of mr. kite"", too. it's too hard to pick.",I love the concept behind it. What's your favorite track on the album?
"he did, ",george couldn't nail a perfect take on the day.,contingency,because,mid,"he did, because george couldn't nail a perfect take on the day.",No he didn't.
"george is good, ",paul was really a prodigy.,comparison,but,mid,"george is good, but paul was really a prodigy.",I didn't know that.
"my dad never listened to the beatles, ",he likes paul mccartney's solo music.,comparison,but,mid,"my dad never listened to the beatles, but he likes paul mccartney's solo music.",I grew up listening to their music with my dad.
i do too ,i love maggie mae more.,comparison,but,mid,i do too but i love maggie mae more.,I love Dig It on that album.
"he was talking about how he just got out of high school when it came out, ","it was the summer of love, and how he loved that album.",expansion,and,mid,"she said he's a big fan. he was talking about how he just got out of high school when it came out, and it was the summer of love, and how he loved that album.",So Billy Joel is a Beatle's fan?
"he's played a lot of beatle's songs during his career she said, ",his fans were happy to hear him singing something he enjoys so much.,contingency,so,mid,"he's played a lot of beatle's songs during his career she said, so his fans were happy to hear him singing something he enjoys so much.",Billy Joel's had a long career and a lot of hits.
wasn't the revolver album the last album the beatles recorded ,they stopped any live performances?,temporal,before,mid,wasn't the revolver album the last album the beatles recorded before they stopped any live performances?,"Oh, right. Those were great songs as well."
they probably won't ,the world would welcome it.,comparison,but,mid,they probably won't but the world would welcome it.,Should Paul and Ringo get together on a new album?
And my memories of most of the songs are connected to my childhood home.,it feels wrong listening to it somewhere else?,contingency,so,begin,so it feels wrong listening to it somewhere else?,Yeah. And my memories of most of the songs are connected to my childhood home.
"i know everyone loves that song, ",i really can't stand it.,comparison,but,mid,"i know everyone loves that song, but i really can't stand it.",Hey Jude is always a classic!
"the movie didn't have much of a plot, ",the music was awesome.,comparison,but,mid,"the movie didn't have much of a plot, but the music was awesome.",Why?
"well, the title track of course, ",that's at the very beginning of the movie.,expansion,in fact,mid,"well, the title track of course, in fact that's at the very beginning of the movie. that i think is one of the best parts of the movie.",I haven't seen the movie myself. What songs do they sing?
"yes, i like that one too.","my all time favorite is ""a day in the life"".",comparison,but,begin,"yes, i like that one too.  but my all time favorite is ""a day in the life"".","My favorite track is ""Lucy in the Sky With Diamonds"".  What do you think of that song?"
i didn't i didn't know that.,"you know, there are so many excellent tracks on that album.",comparison,but,begin,"i didn't i didn't know that. but  you know, there are so many excellent tracks on that album.",Yes. In fact some claim that A Day in the Life was the best Lennon/McCartney collaboration.
i think its great too ,yellow submarine as a song was awesome.,comparison,but,mid,i think its great too but yellow submarine as a song was awesome.,"You are right, I think the best is All You Need is Love."
it was kind of a step back ,you cant keep putting out albums like that.,comparison,but,mid,it was kind of a step back but you cant keep putting out albums like that.,The album was a bit different.
"i agree, ",i would have to pick the white album.,comparison,but,mid,"i agree, but i would have to pick the white album. i like the songs on that one a litte bit better.",I would have to go with Abbey Road. So many classic hits on one album.
this is a random question ,did you ever listen to music from the 50's and 60's?,comparison,but,mid,"this is a random question but did you ever listen to music from the 50's and 60's? you know, groups like the beach boys and the beatles?",My favorit song is Yellow Submarine. Such a catchy song.
i can't remember which song ,"i know the song was so short, like maybe only two minutes when maybe paul or john were recording in the studio they tried to add stuff to the intro, play a bit of harmonica solo or something to lengthen the song enough to be recorded.",comparison,but,mid,"i can't remember which song but i know the song was so short, like maybe only two minutes when maybe paul or john were recording in the studio they tried to add stuff to the intro, play a bit of harmonica solo or something to lengthen the song enough to be recorded.","I thought it's cool that the movie That Thing You do, the song was made to sound like Beatles' at least in my opinion they do."
"i can't remember which song but i know the song was so short, like maybe only two minutes when maybe paul ","john were recording in the studio they tried to add stuff to the intro, play a bit of harmonica solo or something to lengthen the song enough to be recorded.",expansion,or,mid,"i can't remember which song but i know the song was so short, like maybe only two minutes when maybe paul or john were recording in the studio they tried to add stuff to the intro, play a bit of harmonica solo or something to lengthen the song enough to be recorded.","I thought it's cool that the movie That Thing You do, the song was made to sound like Beatles' at least in my opinion they do."
wow yeah i can't remember what song it was ,i remember reading about it too.,comparison,but,mid,wow yeah i can't remember what song it was but i remember reading about it too.,"I can't remember which song but I know the song was so short, like maybe only two minutes when maybe Paul or John were recording in the studio they tried to add stuff to the intro, play a bit of harmonica solo or something to lengthen the song enough to be recorded."
"well, they had tons of good music, ",not all their songs were number ones.,comparison,but,mid,"well, they had tons of good music, but not all their songs were number ones.",Which ones are missing?
i'd say it's almost like the wall of the beatles catalog ,it has so many popular songs and is so iconic.,contingency,because,mid,of course not.  i'd say it's almost like the wall of the beatles catalog because it has so many popular songs and is so iconic.,It doesn't hurt that there are multiple popular songs on that album.
"it's designed to sound like a live album, ",it sounds really distinct.,contingency,so,mid,"it's designed to sound like a live album, so it sounds really distinct.","Oh really? I'm not sure I know that album, what songs are on it?"
"well i prefer the original version better, ",elton's version is pretty good too.,comparison,but,mid,"well i prefer the original version better, but elton's version is pretty good too.",Oh yeah! I know that one. Elton John did a good cover a that song.
"that's a good idea, ",the cds are probably over twenty dollars.,contingency,because,mid,"that's a good idea, because the cds are probably over twenty dollars.",I'm not sure; I'd like to listen to a few of the alternate takes first and then decide whether to buy it or not.
"yeah, i know a lot of people who love the white album, ",i prefer abbey road.,comparison,but,mid,"yeah, i know a lot of people who love the white album, but i prefer abbey road.",Everyone seems to have a different opinion on their favorite Beatles album.
"also good, ",not my favorite.,comparison,but,mid,"also good, but not my favorite. ob-la-di, ob-la-da is probably my all-time favorite.",Great choices. What about Yellow Submarine?
"think motown, ",a little earlier.,comparison,but,mid,"actually, a lot of african american girl groups, for one thing. think motown, but a little earlier.",Really? Who would they typically cover?
"it's by the marvelettes, ",the beatles made a cover version of it.,comparison,but,mid,"yeah, you know that song ""please mr. postman?"" it's by the marvelettes, but the beatles made a cover version of it.","Wow, that's surprising."
i mean the producer worked wonders.,you can tell this was disheveled.,comparison,but,begin,i mean the producer worked wonders. but you can tell this was disheveled.,The mixing was great.
They could've left off a few.,then it wouldn't be the white album.,comparison,but,begin,but then it wouldn't be the white album.,No they aren't. They could've left off a few.
"funny, my dad did the same thing.","now that he's 87, he actually likes the beatles!",comparison,but,begin,"funny, my dad did the same thing. but now that he's 87, he actually likes the beatles!  guess now he's comparing them to modern music.","Yeah, our parents used to complain about how the lyrics didn't make any sense. They should give a listen to the stuff that passes for music these days."
"i prefer lennon's ""come together"" ","""here comes the sun is definitely a close second for me.",comparison,but,mid,"i prefer lennon's ""come together"" but ""here comes the sun is definitely a close second for me.","That would definitely be George Harrison's ""Here Comes the Sun.""  You?"
i think mine is paul ,i haven't really made up my mind,comparison,but,mid,who is your favorite member? i think mine is paul but i haven't really made up my mind,"Yeah I love them, and so do most of my friends"
"yeah i like paul and john, ","i think george was the most underrated, unless you count ringo",comparison,but,mid,"yeah i like paul and john, but i think george was the most underrated, unless you count ringo",Who is your favorite member? I think mine is Paul but I haven't really made up my mind
"it's so hard to choose, ",i think i have it narrowed down to abbey road and sgt.,comparison,but,mid,"it's so hard to choose, but i think i have it narrowed down to abbey road and sgt. pepper's lonely hearts club band,",What is your favorite album by the Beatles?
"i agree, ","i do still like listening to their early work sometimes, like help!, for a change of pace.",comparison,but,mid,"i agree, but i do still like listening to their early work sometimes, like help!, for a change of pace.",Those are both great ones to choose from. I definitely like the later albums more than the earlier ones.
i think paul wrote more songs than john ,the ones john wrote were just so magical.,comparison,but,mid,yes! i think paul wrote more songs than john but the ones john wrote were just so magical.,I love that song! It is so relaxing.
"man tha's high way robbery ,",i'll pay you that if there in good shape.,comparison,but,mid,"man tha's high way robbery ,but i'll pay you that if there in good shape.","no way man the beatles go for more than that, try to double that"
"i know this gonna be a hard question, ",which song is your favorite?,comparison,but,mid,"me too! i know this gonna be a hard question, but which song is your favorite?","totally agreed, I loved their music like crazy"
because it is entirely subjective.,", i like ringo the best.",expansion,for example,begin,"because it is entirely subjective. for example, i like ringo the best.",Why?
a lot of people do.,", that does not mean he is the best.",comparison,but,begin,"a lot of people do. but, that does not mean he is the best.",Col. I thought everyone liked Paul.
"i normally don't care for that type of music, ",i do like the beatles and their music.,comparison,but,mid,"i normally don't care for that type of music, but i do like the beatles and their music.",Do you like the Beatles music?
"well, i like beatles music a little, ",wouldn't want to hear it constantly!,comparison,but,mid,"well, i like beatles music a little, but wouldn't want to hear it constantly!",My mom has a 3-disc CD and plays it constantly!
"that was a good one, ","i like ""she loves me"" better.",comparison,but,mid,"that was a good one, but i like ""she loves me"" better.","Me, too. I heard ""I Want to Hold Your Hand""."
i prefer the older stuff ,the early music is fun sometimes.,comparison,but,mid,"oh, ok you like the early stuff. i prefer the older stuff but the early music is fun sometimes.","I guess the pop type ones like ""She Loves You"" and ""Eight Days a Week""."
"i thought i knew the band, ",i didn't recognize the song.,comparison,but,mid,"i thought i knew the band, but i didn't recognize the song. what album is it on?",The Beatles. I'd consider it one of their lesser known songs.
"the other songs are great too, ",those are the ones i like the best.,comparison,but,mid,"""helter skelter"", revolution"", ""rocky raccoon"", and ""dear prudence"". the other songs are great too, but those are the ones i like the best.",What songs are your favorites?
"that's true, ",not beatles level.,comparison,but,mid,"that's true, but not beatles level.",People talk about Dylan having a huge influence.
"there are some prominent examples, ",i think if we made an attempt to quantify influence that the velvet underground would pale in comparison to the beatles.,comparison,but,mid,"there are some prominent examples, but i think if we made an attempt to quantify influence that the velvet underground would pale in comparison to the beatles.","Well, what about the Velvet Underground, weren't so many famous bands inspired to start bands after seeing The Velvet Underground."
"i'm not a die-hard fan, ",i do enjoy their music.,comparison,but,mid,"i'm not a die-hard fan, but i do enjoy their music.",Are you a Beatles fan?
"well, of course they did.",what ones are you thinking of?,comparison,but,begin,"well, of course they did. but what ones are you thinking of?",They had a couple of strange ones too.
it has a different sound ,i really dig it.,comparison,but,mid,it has a different sound but i really dig it.,What a great song!
"yeah, they've been around a long time, ",their songs are so classic.,comparison,but,mid,"yeah, they've been around a long time, but their songs are so classic. hey jude is one of my favorites.","Oh yeah, I don't know much about the Beatles. They're pretty old right."
"yep, they had a ton of good songs, ",some times they got a little wierd.,comparison,although,mid,"yep, they had a ton of good songs, although some times they got a little wierd.",I love the song Yesterday...that's them right?
"i doubt that they would have all the time, ","possibly they would have come together for ""reunion"" tours.",comparison,but,mid,"i doubt that they would have all the time, but possibly they would have come together for ""reunion"" tours.",Do you think the group would have remained intact?
i used to growing up ,my parents love them.,contingency,because,mid,i used to growing up because my parents love them. do you?,Do you ever listen to the Beatles?
"yes, we had tickets for the magic mystery tour ",we encountered sgt.,comparison,but,mid,"yes, we had tickets for the magic mystery tour but we encountered sgt. peppers lonely hearts gang.",Thats near the Beatles Strawberries Fields Forever am I correct?
"i do like some of their songs, ",not any more than i like other group's songs.,comparison,but,mid,"i do like some of their songs, but not any more than i like other group's songs.",I guess I feel the same way.
i just like it ,i think it sounds good.,contingency,because,mid,i've heard that.  i don't know.   i just like it because i think it sounds good.,Isn't that the one that they thought was written about drugs?
"i know they did a lot of songs, ",i feel that same way.,comparison,but,mid,"i know they did a lot of songs, but i feel that same way.",I like it too.  I don't know of any other ones of theirs that I think too much about.
"sgt pepper's lonely heart band, i fell for the album's artwork ",i heard any of the songs.,temporal,before,mid,"sgt pepper's lonely heart band, i fell for the album's artwork before i heard any of the songs.","Abbey Road is really good, what's your favorite?"
"good pick,",clearly sgt pepper is the best.,comparison,but,mid,"good pick,but clearly sgt pepper is the best.",I will start it off than. I really liked Revolver. This album changed the way people thought of albums.
my favorite sounds silly ,is yellow submarine.,comparison,but,mid,my favorite sounds silly but is yellow submarine.,What is your favorite song?
"it's funny that i'm not that old, ",they're such a part of my childhood anyway.,comparison,but,mid,"it's funny that i'm not that old, but they're such a part of my childhood anyway. i mean i wasn't even alive in the sixties.","I guess so, I mean they're pretty old aren't they? I do like Hey Jude, though."
"i knew they were english, ",never knew what area.,comparison,but,mid,"i knew they were english, but never knew what area.",I never realized the Beatles were from Liverpool.
it works because it sounds rockish modernly ,the same as the old one too,comparison,but,mid,it works because it sounds rockish modernly but the same as the old one too,oh yeah i have heard that one
"yes i do, ",it goes a little deep for me.,comparison,but,mid,"yes i do, but it goes a little deep for me.","Do you enjoy the song ""Within You Without You?"""
"that's funny, i feel the same way about that song, ",i embrace it.,comparison,but,mid,"that's funny, i feel the same way about that song, but i embrace it.","Exactly, it feels like a trance."
"Anyway, the novel has all these long passages about being alone in a forest...",that's not what the song's about at all!,comparison,but,begin,but that's not what the song's about at all!,"It's kind of understandable though. Anyway, the novel has all these long passages about being alone in a forest..."
i will i have alot of there albums ,it's no where near 100,comparison,but,mid,i will i have alot of there albums but it's no where near 100,let me know what he says
it seemed like a wild time ,it was really so innocent.,comparison,but,mid,it really does. it seemed like a wild time but it was really so innocent.,Isn't that the truth. I guess it does make one think of yesterday.
"hmm, that's a hard choice ",i think in my life.,comparison,but,mid,"hmm, that's a hard choice but i think in my life. you?",They are my absolute favorite. What's your favorite song?
aw this should be good ,i'm the biggest beatle fan.,contingency,because,mid,aw this should be good because i'm the biggest beatle fan. let's do this!,You up for a game of Beatles Trivia?
i haven't seen the movie ,i want to.,comparison,but,mid,i haven't seen the movie but i want to.,Yes. I liked the scene with I Want to Hold Your Hand.
in september 1969 john lennon told them he was leaving the group ,they did not announce it until 1970.,comparison,but,mid,in september 1969 john lennon told them he was leaving the group but they did not announce it until 1970.,When did they break up?
"not really, ",they're a great band.,comparison,but,mid,"not really, but they're a great band.",Do you ever listen to The Beatle's?
"it's before my time, ","i like ""hey jude"" when i'm in the mood for that kind of thing.",comparison,but,mid,"it's before my time, but i like ""hey jude"" when i'm in the mood for that kind of thing. what about you?",Can you name a favorite Beatle's song of yours?
"they're before my time also, ","i tend to like their later, more experimental sounding stuff.",comparison,but,mid,"they're before my time also, but i tend to like their later, more experimental sounding stuff.","It's before my time, but I like ""Hey Jude"" when I'm in the mood for that kind of thing. What about you?"
was there any film of this ,i can watch it?,contingency,so,mid,was there any film of this so i can watch it?,"True,some elders were upset the Beatles set a bad example for Japanese youth by leading them away from the traditional Japanese values."
"""have a number of great songs ready to play at your funeral"" isn't a standard form of praise for a band, ",it's so true in the case of the beatles!,comparison,but,mid,"yeah, that's a really good one. ""have a number of great songs ready to play at your funeral"" isn't a standard form of praise for a band, but it's so true in the case of the beatles!",I think Let It Be would be my pick. It's also a really good retrospective and the lyrics are about dealing with pain and loss and depression.
"that's a hard one, ","i'm going to go with taxman, because george sang lead on it.",comparison,but,mid,"that's a hard one, but i'm going to go with taxman, because george sang lead on it.",Paul McCartney. What's your favorite song?
"that's a hard one, but i'm going to go with taxman, ",george sang lead on it.,contingency,because,mid,"that's a hard one, but i'm going to go with taxman, because george sang lead on it.",Paul McCartney. What's your favorite song?
"not very many, ",there are a lot of them pictured.,comparison,although,mid,"not very many, although there are a lot of them pictured.",How many people can you name from the Sgt. Pepper album cover?
i loved them all ,my favorite was john lennon.,comparison,but,mid,i loved them all but my favorite was john lennon.,Who was your favorite Beatle?
there was - ,i can't remember his name!,comparison,but,mid,there was - but i can't remember his name!,"Ah, that's right. I thought that maybe there was a different drummer before him."
"yeah, their early songs were great ",i'm more a fan of their later songs.,comparison,but,mid,"yeah, their early songs were great but i'm more a fan of their later songs. what about you?","Cool! Do you like their earlier songs like ""Help"" and ""I Wanna Hold Your Hand?"""
"peppers lonely hearts club band album, ",the early songs have a special place in my heart!,comparison,but,mid,"i do like their later songs, like on their sgt. peppers lonely hearts club band album, but the early songs have a special place in my heart!","Yeah, their early songs were great but I'm more a fan of their later songs. What about you?"
i love across the universe and eleanor rigby -- ,"like you said, it's hard to pick!",comparison,but,mid,"i love across the universe and eleanor rigby -- but like you said, it's hard to pick!",What's your favorite from their later songs?
i am sure it is ,beatles old original lps are probably worth twice as much as the cds.,comparison,but,mid,i am sure it is but beatles old original lps are probably worth twice as much as the cds.,I have a double cd collection of Beatle hits. You think it may be worth something?
yes sir paul mccarthy did ,i am not sure of the name.,comparison,but,mid,yes sir paul mccarthy did but i am not sure of the name.,Did Paul McCarthy start another group after the Beatles group broke up?
"well there is the title song obviously, ","also ""i should have known better"".",comparison,but,mid,"well there is the title song obviously, but also ""i should have known better"".",What is on that album. I forgot.
"it's on the hard day's night album in north america, ",not in the united kingdom.,comparison,but,mid,"it's on the hard day's night album in north america, but not in the united kingdom.",I don't remember that one.
"he was, and he made a lot of contributions, ",the engineer did a lot too.,comparison,but,mid,"he was, and he made a lot of contributions, but the engineer did a lot too.",I thought George Martin was the producer.
"i believe that was their first album released in the us, ","in the uk i think they released ""please please me"" first.",comparison,but,mid,"i believe that was their first album released in the us, but in the uk i think they released ""please please me"" first.",Was that their first album?
"paul mccartney still does concerts, ",he does them as a solo act.,comparison,but,mid,"paul mccartney still does concerts, but he does them as a solo act.  yes, they broke up years ago and retired the band.",They retired? I didn't know that. I thought they still go on tour.
i don't know.,"most of the time when a group member wants to go solo, it means that he or she leaves because of money reasons.",comparison,but,begin,"i don't know. but most of the time when a group member wants to go solo, it means that he or she leaves because of money reasons.",Why did he want to go solo?
"but most of the time when a group member wants to go solo, it means that he or she leaves ",of money reasons.,contingency,because,mid,"i don't know. but most of the time when a group member wants to go solo, it means that he or she leaves because of money reasons.",Why did he want to go solo?
