arg1,arg2,relation,connective,type,original_utt,original_utt_prev
never made that connection before ,that is very true.,comparison,but,mid,never made that connection before but that is very true.,I never noticed if it is. I will say the lana del rey song young and beautiful song lyrics make me think back to When I'm 64.
paul wrote it for john's son julian who he felt bad before ,his parents were divorcing.,contingency,because,mid,i believe it wasn't a preconceived album. paul wrote it for john's son julian who he felt bad before because his parents were divorcing.,I think it was thrown together on Capital records to fulfill a commitment.
paul wrote it for john's son julian who he felt bad ,because his parents were divorcing.,temporal,before,mid,i believe it wasn't a preconceived album. paul wrote it for john's son julian who he felt bad before because his parents were divorcing.,I think it was thrown together on Capital records to fulfill a commitment.
"correct,and obviously it was a huge hit,",not an album they planned.,comparison,but,mid,"correct,and obviously it was a huge hit,but not an album they planned.",I believe it wasn't a preconceived album. Paul wrote it for John's son Julian who he felt bad before because his parents were divorcing.
"i think capital just took some singles and put them together on an,album and hey jude became the title track ",of its success.,contingency,because,mid,"i think capital just took some singles and put them together on an,album and hey jude became the title track because of its success.","Correct,and obviously it was a huge hit,but not an album they planned."
"they started out that way, ",then became studio musicians,comparison,but,mid,"they started out that way, but then became studio musicians",Weren't they a pop band?
"i haven't seen it either, ",i bought the soundtrack.,comparison,but,mid,"i haven't seen it either, but i bought the soundtrack.","I haven't, no. Did you like it?"
"yeah, it's really good.",it's hard to compare to the originals.,comparison,but,begin,"yeah, it's really good. but it's hard to compare to the originals.",Was it as good as the soundtrack to Across the Universe?
"yeah, the differences between each part are quite overt, ",somehow it all fits together and works.,comparison,but,mid,"yeah, the differences between each part are quite overt, but somehow it all fits together and works.",I like how experimental it is. I also like seeing the clear contrast between John and Paul contained in one song.
pepper's lonely hearts club band ,my favorite has to be the white album.,comparison,but,mid,i like sgt. pepper's lonely hearts club band but my favorite has to be the white album.,What's your favorite Beatles album?
"i think i was expecting something like yesterday, ","ob-la-di, ob-la-da?",comparison,but,mid,"i think i was expecting something like yesterday, but ob-la-di, ob-la-da?","Tough call. I think it's a toss-up between Ob-La-Di, Ob-La-Da and Hello, Goodbye."
"i really like all you need is love, ","baby, you're a rich man is just a weird, fun song.",comparison,but,mid,"i really like all you need is love, but baby, you're a rich man is just a weird, fun song.",Really?  Not All You Need Is Love?
"you are too young to remember the beatles, ",they are one of the greatest musicians/song writers of the modern world.,comparison,but,mid,"you are too young to remember the beatles, but they are one of the greatest musicians/song writers of the modern world.","Yeah, I guess it is.  It suits you."
"yeah, exactly.","people today still love to trash artists like justin bieber, comparing him to the beatles.",contingency,because,begin,"yeah, exactly. because people today still love to trash artists like justin bieber, comparing him to the beatles.","You mean between ""Serious Pop"" and ""Lightweight Pop,"" right?"
"it's true that there is a bit of discreet desperation, ","at least deep, sad, longing in many of the songs of that album.",expansion,or,mid,"it's true that there is a bit of discreet desperation, or at least deep, sad, longing in many of the songs of that album.","Oh yes! It's such a trippy, heavy, slightly desperate song. Beautiful."
"yes, i love the look, ","more the songs, like i am the walrus.",comparison,but,mid,"yes, i love the look, but more the songs, like i am the walrus.","Now that you mention it, I could have seen that from the style of eyeglasses that you're wearing."
jim sturgess and evan rachel wood  are the main two.,big ensemble cast.,comparison,but,begin,"no, it is with actors and they sing the songs too.  jim sturgess and evan rachel wood  are the main two. but big ensemble cast.",Who is in it? any actual beatles?
"honestly, i know it's corny, ",i like i want to hold your hand.,comparison,but,mid,"honestly, i know it's corny, but i like i want to hold your hand.",What is your favorite Beattles song?
it's a little slow for me.,i don't like the white album that much.,comparison,but,begin,it's a little slow for me.  but i don't like the white album that much.,What about In My Life?
however it was probably ,he likes heavy metal and that was too light for him i suppose.,contingency,because,mid,i really don't recall his answer. however it was probably because he likes heavy metal and that was too light for him i suppose.,Did he say why he didn't like them? Or who he did like?
i like their solo stuff ,not so much johns or paul's.,comparison,but,mid,i like their solo stuff but not so much johns or paul's.,Ringo is my favorite Beatle. George is second.
i never heard of it ,if he's in it i'd like it.,comparison,but,mid,ah. i never heard of it but if he's in it i'd like it.,A TV show for kids.
it was but seems credited to lennon-mccartney.,was about john's memories of playing in the fields.,comparison,but,begin,it was but seems credited to lennon-mccartney. but was about john's memories of playing in the fields.,"It was a lennon written one , right?"
i had not that about that one ,that's good.,comparison,but,mid,i had not that about that one but that's good. keep going.,The Beatles and Jackson 5 both had lead singers who ventured out on their own.
"very good, you don't know their songs, ",you know their names--how come?,comparison,but,mid,"very good, you don't know their songs, but you know their names--how come?","Actually I can--John Lennon,  Paul McCartney, George Harrison,  and Ringo Starr."
not too likely ,what would you suggest.,comparison,but,mid,not too likely but what would you suggest.,Very funny young man--maybe you should listen to the Beatles once in awhile instead of that rap stuff.
"before that songwriters rarely recorded...elvis was just a singer, not a writer ",the beatles changed the game for everybody.,contingency,so,mid,"they were some of the first rock musicians to write and record their own songs.  before that songwriters rarely recorded...elvis was just a singer, not a writer so the beatles changed the game for everybody.",What's the big deal?
they were some of the first rock musicians to write and record their own songs.,"that songwriters rarely recorded...elvis was just a singer, not a writer so the beatles changed the game for everybody.",temporal,before,begin,"they were some of the first rock musicians to write and record their own songs.  before that songwriters rarely recorded...elvis was just a singer, not a writer so the beatles changed the game for everybody.",What's the big deal?
"i know you're probably too young, ",do you know anything about the beetles?,comparison,but,mid,"i know you're probably too young, but do you know anything about the beetles?",Really
"i liked those too, ",i got sick of hearing them on the radio a lot.,comparison,but,mid,"i liked those too, but i got sick of hearing them on the radio a lot. so i mostly like the ones that weren't as popular.","""Let it Be"" and ""Hey Jude"" I liked a lot."
adult beatles is harder ,they did solo stuff as well.,contingency,because,mid,adult beatles is harder because they did solo stuff as well.,"Oh yeah, that's a good one.  I liked that too."
"it has a few songs i know, like i saw her standing there, twist and shout, and love me do, ",most of it is unfamiliar.,comparison,but,mid,"the album please please me. it has a few songs i know, like i saw her standing there, twist and shout, and love me do, but most of it is unfamiliar.",Like what?
"it has a few songs i know, like i saw her standing there, twist ","shout, and love me do, but most of it is unfamiliar.",expansion,and,mid,"the album please please me. it has a few songs i know, like i saw her standing there, twist and shout, and love me do, but most of it is unfamiliar.",Like what?
"well, not so much at the time, ",i have come to appreciate him.,comparison,but,mid,"well, not so much at the time, but i have come to appreciate him.","So you were a John Lennon guy, imagining no religion and the world as one."
"really tragic how he passed, ",he lived such a cool life.,comparison,but,mid,"really tragic how he passed, but he lived such a cool life.",That is a good choice.
i use mp3 a lot ,cd's are in the past.,contingency,so,mid,1 of them is a record and two are cd's. i use mp3 a lot so cd's are in the past.,How many album covers do you curently own?
my reason for liking them is ,it shows the creative process.,contingency,because,mid,my reason for liking them is because it shows the creative process.,Yes. I like the different takes on the songs.
like across the universe and blackbird.,i just never really listened to them.,comparison,but,begin,"i mean, i like some of their songs. like across the universe and blackbird. but i just never really listened to them.",What do you mean?
helter skelter is a favorite ,i have no real idea what it means.,comparison,although,mid,helter skelter is a favorite although i have no real idea what it means.,John Lennon wrote that song and I think he intentionally made it strange. I know the Walrus part refers to a Lewis Carroll poem.
"i don't know, they were ",my time so i only know the music.,temporal,before,mid,"i don't know, they were before my time so i only know the music.",Who is your favorite Beatle?
"yeah, it is ",yellow submarine and others are cool,comparison,but,mid,"yeah, it is but yellow submarine and others are cool","I like it all, their early stuff is fun."
kanye speed up his guitar track ,paul did not even realize at first it was him.,contingency,so,mid,well he was working with kanye separately.  kanye speed up his guitar track so paul did not even realize at first it was him.,so how did he not know?
i dig it.,"for me when they started to get more...i don't know, spiritual and psychedelic, that's when they got really interesting.",comparison,but,begin,"i dig it. but for me when they started to get more...i don't know, spiritual and psychedelic, that's when they got really interesting.","Not me, I found that too weird for my taste. I like their earliest stuff. So sweet, melodic and romantic."
she did a good job ,it's still not the same.,comparison,but,mid,i heard a couple. she did a good job but it's still not the same.,Have you heard Amy Winehouse's covers?
"i don't know about that, they have some great hits ",the best band ever is a hard title to win!,comparison,but,mid,"i don't know about that, they have some great hits but the best band ever is a hard title to win!",Do you think the beatles are the greatest band of all time?
that's true!,for every song like hey jude that the beatles had they also had songs like taxman which were kind of mediocre.,comparison,but,begin,that's true! but for every song like hey jude that the beatles had they also had songs like taxman which were kind of mediocre.,"Come on, who else could have had EVERYONE at the superbowl singing one song like McCartney did with Hey Jude?"
lady madonna might sound like a nice and light song ,its very deep and emotional.,comparison,but,mid,a simpler time? the beatles wrote about some heavy content. lady madonna might sound like a nice and light song but its very deep and emotional.,"That's a great call, for me I put on the 1's Album and just go back to their hits. Its refreshing and brings me back to a simpler time."
it came out in 1967 ,that would make fifty years.,contingency,so,mid,i think you're right. it came out in 1967 so that would make fifty years.,"Oh man, it has been a long time since I've listened to Sgt. Pepper. I think this year is the fiftieth anniversary."
"it's true revolver wasn't a 'concept' album, ","that's where they started with all the tape experimentation; faster, slower, backward...",comparison,but,mid,"it's true revolver wasn't a 'concept' album, but that's where they started with all the tape experimentation; faster, slower, backward...",Really? I always think of Sergeant Pepper as the first *real* concept album.
"i've listened to revolver, ",i never thought of sgt.,comparison,but,mid,"interesting! i've listened to revolver, but i never thought of sgt. pepper's lonely hearts club band as a continuation of it.","It's still just a continuation of Revolver's experimentation. Listen, for example, to the reversed guitar on Tomorrow Never Knows."
Pepper's Lonely Hearts Club Band as a continuation of it.,"listen to weird musical processing they did on yellow submarine -- *that* was a brand-new technique at the time, too.",expansion,or,begin,"or listen to weird musical processing they did on yellow submarine -- *that* was a brand-new technique at the time, too.","Interesting! I've listened to Revolver, but I never thought of Sgt. Pepper's Lonely Hearts Club Band as a continuation of it."
"they all have regular jobs, ",they play 90 shows every year.,comparison,but,mid,"they all have regular jobs, but they play 90 shows every year.","Wow, they must be really good to last that long."
"no, i think it was ",his mom was killed when he was young.,contingency,because,mid,"no, i think it was because his mom was killed when he was young.",Do you think that was due to Yoko Ono's influence?
"i may get some flack for saying this, ",i think the beatles are overrated.,comparison,but,mid,"i may get some flack for saying this, but i think the beatles are overrated.","I know, right?  It permeated his music."
maybe it is ,i am younger and i wasn't alive when they were at their height.,contingency,because,mid,maybe it is because i am younger and i wasn't alive when they were at their height.  i don't know.,How could you even think that?
"i think the beatles were masters of taking a song that sounds clean on the surface, ",it had some crazy alternative meaning.,comparison,but,mid,"i think the beatles were masters of taking a song that sounds clean on the surface, but it had some crazy alternative meaning.","Well, I think they did make decent songs.  I guess I like my bands with a little more edge to them."
i'm a little younger ,i love their music.,comparison,but,mid,i'm a little younger but i love their music.,I grew up listening to them.
it was unique ,it went so long.,contingency,because,mid,it was unique because it went so long.,"Actually that's one of mine too,love it!"
"its a little old school, ",do you like beatles music?,comparison,but,mid,"its a little old school, but do you like beatles music?",Great talking to you
"it was good, ",i like all of it.,comparison,but,mid,"mmm-hmm.  it was good, but i like all of it.",Sounds nice!  I like their earlier music myself.
"yes, he was married and had a son ",the beatles even became famous.,temporal,before,mid,"yes, he was married and had a son before the beatles even became famous.",Wait a minute--I didn't know John Lennon had a kid back in those days!
"i'm not sure about that, ",i remember reading that the lyrics changed before it was recorded and so the title changed.,comparison,but,mid,"i'm not sure about that, but i remember reading that the lyrics changed before it was recorded and so the title changed.",So why did the song title get changed?
"i'm not sure about that, but i remember reading that the lyrics changed ",it was recorded and so the title changed.,temporal,before,mid,"i'm not sure about that, but i remember reading that the lyrics changed before it was recorded and so the title changed.",So why did the song title get changed?
i did like the guitar work ,the best part of that song are the lyrics at the end.,comparison,but,mid,"i did like the guitar work but the best part of that song are the lyrics at the end. ""and in the end, the love you take is equal to the love you make"".","What about the guitar work in ""The End""? I understand George, Paul McCartney, and John Lennon played each of the three sets of solos in that song."
i like them both ,if i had to choose it would be the beatles as a band.,comparison,but,mid,i like them both but if i had to choose it would be the beatles as a band.,Do you prefer the music of the Beatles as a band or as individual solo artists?
"in today's economy, they would have made hundreds of millions to do a reunion tour ","with that would be an album, a dvd and so on, they would have made a fortune !",expansion,and,mid,"i do. in today's economy, they would have made hundreds of millions to do a reunion tour and with that would be an album, a dvd and so on, they would have made a fortune !","If John Lennon had lived, do you think the Beatles would have re-united?"
so hard to pick one !,you can't go wrong by owning rubber soul .,comparison,but,begin,so hard to pick one ! but you can't go wrong by owning rubber soul .,What was your favorite Beatle album?
"i guess not, ",most people don't know about it.,comparison,but,mid,"i guess not, but most people don't know about it.","Well, that's not really different."
"i guess not, ",some people probably don't know the difference in spelling.,comparison,but,mid,"i guess not, but some people probably don't know the difference in spelling.","I guess not, but most people don't know about it."
"that's a tough one, ",i think probably abbey road.,comparison,but,mid,"that's a tough one, but i think probably abbey road. what about you?",Which of their albums do you like best?
"i know the end gets experimental, ",to me it's a little too repetitive and a little too lovey dovey.,comparison,but,mid,"i know the end gets experimental, but to me it's a little too repetitive and a little too lovey dovey.",Why's that?
"i love their early stuff, ",this track just doesn't connect with me.,comparison,but,mid,"i'm going to go with ""eight days a week."" i love their early stuff, but this track just doesn't connect with me.","Well, what will it be then?"
i don't own any albums ,i am a fan of their work,comparison,but,mid,i don't own any albums but i am a fan of their work,Do you have any Beatles albums?
"a lot of people think ringo starr was the first and in some cases the only drummer, ",he actually didn't join until????,comparison,but,mid,"a lot of people think ringo starr was the first and in some cases the only drummer, but he actually didn't join until???? and for your chance to be queen for a day, who was the very first drummer?",Sgt. Pepper's Lonely Heart Club Band.......the story and acting was horrible but the MUSIc/SONGS
"i do actually, not my favorite beatles album, in fact i feel it's near their worst, ",since it's the beatles still has it's moments.,comparison,but,mid,"i do actually, not my favorite beatles album, in fact i feel it's near their worst, but since it's the beatles still has it's moments.",Do you like The Yellow Submarine album?
"i do actually, not my favorite beatles album, ","i feel it's near their worst, but since it's the beatles still has it's moments.",expansion,in fact,mid,"i do actually, not my favorite beatles album, in fact i feel it's near their worst, but since it's the beatles still has it's moments.",Do you like The Yellow Submarine album?
"i mean it's the beatles, so it still has some redeeming value and some great songs, ","the title track i always felt was cheesy, sorry ringo star.",comparison,although,mid,"i mean it's the beatles, so it still has some redeeming value and some great songs, although the title track i always felt was cheesy, sorry ringo star.","I sometimes think I'm alone in my adoration for yellow submarine, it's not very highly regarded amongst their albums."
"i mean it's the beatles, ","it still has some redeeming value and some great songs, although the title track i always felt was cheesy, sorry ringo star.",contingency,so,mid,"i mean it's the beatles, so it still has some redeeming value and some great songs, although the title track i always felt was cheesy, sorry ringo star.","I sometimes think I'm alone in my adoration for yellow submarine, it's not very highly regarded amongst their albums."
"i mean it's the beatles, so it still has some redeeming value ","some great songs, although the title track i always felt was cheesy, sorry ringo star.",expansion,and,mid,"i mean it's the beatles, so it still has some redeeming value and some great songs, although the title track i always felt was cheesy, sorry ringo star.","I sometimes think I'm alone in my adoration for yellow submarine, it's not very highly regarded amongst their albums."
i think paul mccartney wrote most of it ,it is also credited to john lennon on the album.,comparison,but,mid,i think paul mccartney wrote most of it but it is also credited to john lennon on the album.,"Can you remember who wrote ""Hey Jude"""
"it was called ""hey jules"" ",it was originally written for julian lennon.,contingency,because,mid,"it was called ""hey jules"" because it was originally written for julian lennon.","No, I had never heard that before, very interesting."
"lay it on me, ",", i might already know it... hehe.",comparison,although,mid,"lay it on me, although, i might already know it... hehe.","Cool, I was reading some trivia the other day and thought it might interesting you."
"okay.. check, the song ""lucy in the sky with diamonds"" a lot of people think is about drugs, ",one it's actually based on a picture lennon's son drew at like age four or so of his classmates.,comparison,but,mid,"okay.. check, the song ""lucy in the sky with diamonds"" a lot of people think is about drugs, but one it's actually based on a picture lennon's son drew at like age four or so of his classmates.  they were like, ""what is this?"" and he said, ""that's lucy!  she's in the sky with diamonds!""","Lay it on me, although, I might already know it... hehe."
"yeah, sadly, john and julian's mother got divorced when the boy was five.","that, julian says john didn't have much contact with him.",temporal,after,begin,"yeah, sadly, john and julian's mother got divorced when the boy was five. after that, julian says john didn't have much contact with him.","Oh, that's neat!"
"i know john lennon's songs, ",i want to listen to more of the original beatles music.,comparison,but,mid,"yeah. i know john lennon's songs, but i want to listen to more of the original beatles music. got any recommendations?","Oh, are you just starting to get into them?"
"ha ha, my father used to claim that that was john lennon's wife's fault.",i heard recently that she had nothing to do with it.,comparison,but,begin,"ha ha, my father used to claim that that was john lennon's wife's fault. but i heard recently that she had nothing to do with it.","Yes, but she was too young for true Beatlemania. She told me she cried the day they broke up."
no way that wasnt a bad track ,nowhere near the best.,comparison,but,mid,no way that wasnt a bad track but nowhere near the best.,I feel like Love Me Do was the Beatles best song
"peppers wasnt bad, ",there was too much variety for me to nail a song down,comparison,but,mid,"peppers wasnt bad, but there was too much variety for me to nail a song down",So nothing from Peppers?
"i do, ",i like him in the beatles as well,comparison,but,mid,"i do, but i like him in the beatles as well",Do you like him as a solo artist?
"apparently they tried having the group play it, ","harrison wasn't satisfied with it, and invited clapton to play the solo, instead.",comparison,but,mid,"well, of course not! apparently they tried having the group play it, but harrison wasn't satisfied with it, and invited clapton to play the solo, instead.","Why did Harrison have Clapton play on that one? I mean, he's not a Beatle."
i do see what you mean ,feel they fit so well with the vibe of the song.,comparison,but,mid,i do see what you mean but feel they fit so well with the vibe of the song.,"Yes, I felt the vocals were slightly weak."
the monkees were similar...,not as good.,comparison,but,mid,the monkees were similar...but not as good.  you're right.,I know...classic.  I don't think anyone has been able to recreate what they had.
"""hey jude"" ","i also love john lennon's ""beautiful boy""  i sing that song to my son all the time.",comparison,but,mid,"""hey jude"" but i also love john lennon's ""beautiful boy""  i sing that song to my son all the time.",What is your favorite Beatles song?
i like most of their songs; ,"my favorites are paperback writer, eleanor rigby, we can work it out, and come together.",comparison,but,mid,"i like most of their songs; but my favorites are paperback writer, eleanor rigby, we can work it out, and come together.",Which of their songs do you like?
"well, ringo starr from the beatles, ",his other band.,comparison,but,mid,"well, ringo starr from the beatles, but his other band.","You are talking about the Beatles, right?"
"well, thats pretty bold.","sure, tell me.",comparison,but,begin,"well, thats pretty bold. but sure, tell me.",You know who the best band ever is?
"well, companies merge all the time.",emi's label manager george martin is the one who signed the beatles.,comparison,but,begin,"well, companies merge all the time. but emi's label manager george martin is the one who signed the beatles.",Kinda funny how that's now EMI
