arg1,arg2,relation,connective,type,original_utt,original_utt_prev
"that's good too, ","""please please me"" is ranked lower than ""i saw her standing there""",comparison,but,mid,"that's good too, but ""please please me"" is ranked lower than ""i saw her standing there""","I was gonna say ""Love me do,"" but ok."
"i don't know many songs, ",i like them.,comparison,but,mid,"i don't know many songs, but i like them.",Do you like the Beatles?
"it seems the beatles were not only great rock group,",designed great album covers as well.,comparison,but,mid,"it seems the beatles were not only great rock group,but designed great album covers as well.",Not that I can think of.
"well there is the 50's rock beatles, ",there is also a more mellow sound they started making in the 60s,comparison,but,mid,"well there is the 50's rock beatles, but there is also a more mellow sound they started making in the 60s",Isn't it all rock?
"yes, those are good songs, too, ",i feel the later stuff has more of a rock n roll sound to it.,comparison,but,mid,"yes, those are good songs, too, but i feel the later stuff has more of a rock n roll sound to it.","I really like the early stuff, like ""If I Fell"" and ""In My Life""."
"i doubt it, ",we joke that if we ever get on antiques roadshow we may bring it and all his albums.,comparison,but,mid,"i doubt it, but we joke that if we ever get on antiques roadshow we may bring it and all his albums.",I wonder if it would be worth any big money?
"my father has some of both, well all the re released everything ",some originals still.,comparison,but,mid,"my father has some of both, well all the re released everything but some originals still.","That is funny, but might profit. He has original albums or re releases?"
it is remastered ,"i still prefer the older original ones, i like a little crackle in the records.",comparison,but,mid,"it is remastered but i still prefer the older original ones, i like a little crackle in the records.",That is cool. i know the later stuff is suppose to sound better being remastered.
i like a clean sound myself ,can see the charm of what you enjoy.,comparison,but,mid,well to each there own. i like a clean sound myself but can see the charm of what you enjoy.,"It is remastered but I still prefer the older original ones, I like a little crackle in the records."
I couldn't name just one.,"if you had to, what would it be?",comparison,but,begin,"but if you had to, what would it be?",OMG. I love them all. I couldn't name just one.
"it's a good song, ",singing it every day...?,comparison,but,mid,"every day?  it's a good song, but singing it every day...?",Yeah. I used to sing that song every day back in high school.
"i used to prefer john, ",now i guess i'd rather listen to paul's solo stuff.,comparison,but,mid,"i used to prefer john, but now i guess i'd rather listen to paul's solo stuff.","Well, who did you think had the best solo career?"
"definately imagine, ",he did a good cover of stand by me.,comparison,but,mid,"definately imagine, but he did a good cover of stand by me.",What was your favorite song by John?
"i know a lot of beatles songs, ",i didn't grow up with them like you did.,comparison,but,mid,"i know a lot of beatles songs, but i didn't grow up with them like you did. what are some interesting things about them i might not know?","Definately Imagine, but he did a good cover of Stand By Me."
"well, he was the drummer, of course, ","he was not the first--they fired some guy named pete best i think, who could have been famous.",comparison,but,mid,"well, he was the drummer, of course, but  he was not the first--they fired some guy named pete best i think, who could have been famous.",Anything interesting about Ringo Starr?
"i've heard them--not classics, ",not too bad.,comparison,but,mid,"i've heard them--not classics, but not too bad.","Well, Ringo actually had the lead on some Beatle songs, such as Act Naturally. and Yellow Submarine."
i've never thought ringo was that talented ,he's still going.,comparison,but,mid,i've never thought ringo was that talented but he's still going.,"I've heard them--not classics, but not too bad."
"i like the early stuff, ",not the weird stuff.,comparison,but,mid,"i like the early stuff, but not the weird stuff.",Are you a Beatles fan?
"yeah, he was so cute ",i had a huge crush on john.,comparison,but,mid,"yeah, he was so cute but i had a huge crush on john.",I switched back and forth. At first I was crazy for Paul.
"i heard little richard was there for the ceremony, and harrison pointed at him ","said, ""it's all his fault, really.""",expansion,and,mid,"i heard little richard was there for the ceremony, and harrison pointed at him and said, ""it's all his fault, really.""",Yeah. When the Beatles were inducted into the Rock Hall of Fame Harrison said they wouldn't be there if not for Little Richard.
"and lennon was influenced by his poor mother, who couldn't raise him ",taught him banjo and gave him a guitar.,comparison,but,mid,"and lennon was influenced by his poor mother, who couldn't raise him but taught him banjo and gave him a guitar.",I heard Harrison studied with him in India.
"yeah, part of that is due to an incredible amount of musical talent.","more than that, they put out songs that people could truly relate to.",comparison,but,begin,"yeah, part of that is due to an incredible amount of musical talent. but more than that, they put out songs that people could truly relate to.",That's definitely true. It's no wonder they're still so popular.
"i just don't see it, i mean they are catchy enough, ",many consider them the best band ever.,comparison,but,mid,"i just don't see it, i mean they are catchy enough, but many consider them the best band ever.","Absolutely not, they are essential in my mind."
"c'mon now great band in their own right, ",they can't hold a candle to the beatles.,comparison,but,mid,"stones as in rolling stones? c'mon now great band in their own right, but they can't hold a candle to the beatles.","I'll check them out, still don't think I'll like them better than The Stones."
"we can agree to disagee, ",who knows maybe i'll notice something with the beatles this time.,comparison,although,mid,"we can agree to disagee, although who knows maybe i'll notice something with the beatles this time.","Stones as in Rolling Stones? C'mon now great band in their own right, but they can't hold a candle to The Beatles."
"i like that, ",i really prefer the original by the beatles.,comparison,but,mid,"we were riding in the car with some young people and come together by aerosmith came on the radio.  i like that, but i really prefer the original by the beatles.","You wouldn't be the first, sometimes it takes more than one listen. By the way Yesterday, listen to that one as well."
john made some good songs ,paul is a genius.,comparison,but,mid,"yeah, i think i'm with you there.  john made some good songs but paul is a genius.",I'd say Paul is.
pet sounds in phenomenal as well ,i think sgt.,comparison,but,mid,yeah i do believe that's right.  pet sounds in phenomenal as well but i think sgt. pepper is still better.,Yeah it was crazy.  I'm sure what Brian Wilson did with Pet Sounds gave them a lot of ideas as well.  I think that's why Paul wanted to do Sgt. Pepper in the first place.
"they do perform, ",not all together.,comparison,but,mid,"they do perform, but not all together.","Wow, do they still perform?"
"and they couldn't do that legally in england or america, ",they traveled to where they could get it easily.,contingency,so,mid,"i think that they were tripping a lot, dropping tons of acid, and that they wanted a different sort of head. and they couldn't do that legally in england or america, so they traveled to where they could get it easily.","Did you believe that they were using drugs? Drugs like opium, or heroin?"
"i am not sure about that, ",the melody sounds familiar.,comparison,but,mid,"i am not sure about that, but the melody sounds familiar.",Twist and shout! Baby baby baby...
"yeah, i know some of their songs use sitar, ",i think it really depends which ones you listen to how much it actually sounds like indian music.,comparison,but,mid,"yeah, i know some of their songs use sitar, but i think it really depends which ones you listen to how much it actually sounds like indian music.",I heard the Beatles were super into Indian music in the 60s. Trippy.
"they're great, ","i think the beatles have them beat, no pun intended.",comparison,but,mid,"they're great, but i think the beatles have them beat, no pun intended.","Not really, I'm more of a Rolling Stones fan"
"there's so many, ",if you like the stones then you should check out day tripper and run for your life,comparison,but,mid,"there's so many, but if you like the stones then you should check out day tripper and run for your life",Oh yeah? What are your favorite songs?
"i've heard that one, and i like it ",it's not my favorite,comparison,but,mid,"are they like all you need is love? i've heard that one, and i like it but it's not my favorite","There's so many, but if you like the Stones then you should check out Day Tripper and Run For Your Life"
"i don't know, ","the deeper you go into their catalogue, the more gems you'll find.",comparison,but,mid,"i don't know, but the deeper you go into their catalogue, the more gems you'll find. it's like a bottomless well of amazing music, especially albums like sgt. pepper's lonely hearts club band and abbey road",I haven't heard of those before. I wonder why they don't get any more attention?
"well, i've read some people think it's about drugs ",john lennon said it was about a drawing his son made.,comparison,but,mid,"well, i've read some people think it's about drugs but john lennon said it was about a drawing his son made.",What do you think Lucy in the Sky with Diamonds is about?
"they are good, ",my favorite is yellow submarine,comparison,but,mid,"they are good, but my favorite is yellow submarine","Yes, and my favorite Got To Get You Into My Life."
"not sure why, maybe just ",everyone knows them the most.,contingency,because,mid,"not sure why, maybe just because everyone knows them the most. they had a good share of media coverage.",Why are they the all time favorite?
mark david chapman killed john lennon ,"he said he was jealous of the beattles and wanted to be ""somebody"" like the beatles.",contingency,because,mid,"mark david chapman killed john lennon because he said he was jealous of the beattles and wanted to be ""somebody"" like the beatles. the beatles' fame got him upset, so he shot and killed the beatles' main leader, john lennon",Why would anyone want to do away with someone like that?
"the beatles' fame got him upset, ","he shot and killed the beatles' main leader, john lennon",contingency,so,mid,"mark david chapman killed john lennon because he said he was jealous of the beattles and wanted to be ""somebody"" like the beatles. the beatles' fame got him upset, so he shot and killed the beatles' main leader, john lennon",Why would anyone want to do away with someone like that?
"ringo starr looks contently retired with  hundreds of millions of dollars in the bank, ",paul mccartney seems to have little to no motive to reform the beatles.,expansion,and,mid,"not looking good for a comeback. ringo starr looks contently retired with  hundreds of millions of dollars in the bank, and paul mccartney seems to have little to no motive to reform the beatles.",That's a shame. Will the Beatles ever make a comeback?
"yes, it is good, ",their later stuff is better.,comparison,but,mid,"yes, it is good, but their later stuff is better.",Do you like the early Beatles work?
"i like their traditional stuff, ",i also really like the white album.,comparison,but,mid,"i like their traditional stuff, but i also really like the white album.",What is your favorite album?
i'll check it out ,i can add it to my collection.,contingency,so,mid,i'll check it out so i can add it to my collection.,It has twenty-something songs.
"the melody is the same, ",the arrangement is quite different.,comparison,but,mid,"the melody is the same, but the arrangement is quite different.",That's a great song. Is the alternate version much different?
"demos and early versions are fun, ",i like when the arrangement is totally different.,comparison,but,mid,"me too! demos and early versions are fun, but i like when the arrangement is totally different.",That's probably my favorite kind of alternate version.
"they're not my favorite band, or my favorite type of genre, ",music today wouldn't be the same without them.,comparison,but,mid,"they're not my favorite band, or my favorite type of genre, but music today wouldn't be the same without them.",What do you think of the Beatles?
"i think hey jude or yesterday, which are the classics, ",really any of their top songs are great.,comparison,but,mid,"i think hey jude or yesterday, which are the classics, but really any of their top songs are great. what about you?",What's your favorite song?
"no, it would be a classic one to go to, ",i have not.,comparison,but,mid,"no, it would be a classic one to go to, but i have not.",That is a classic. Have you seen Paul McCartney or any of them in concert since they stopped the Beatles?
"In my room, there was a spot on the ceiling caused by a leak, and I always wanted to fix it.",the song was metaphorical.,comparison,but,begin,"but the song was metaphorical. it was supposed to be about regrets, or something like that.","I actually grew up in an old farmhouse. In my room, there was a spot on the ceiling caused by a leak, and I always wanted to fix it."
i don't like the very early stuff ,i like the stuff like sergeant pepper's album?,comparison,but,mid,i don't like the very early stuff but i like the stuff like sergeant pepper's album?,What songs do you like that the Beatles' wrote?
people think it is ,it is actually not true.,comparison,but,mid,people think it is but it is actually not true.,Wasn't that about taking LSD?
"i like his beatles music best, ",i do like his solo albums too.,comparison,but,mid,"i like his beatles music best, but i do like his solo albums too.","Oh, do you like him most in the Beatles or his solo projects?"
"i like both john and paul, ",john probably wins.,comparison,although,mid,"i like both john and paul, although john probably wins.",Happiness is a Warm Gun! Who is your favorite Beatle?
"well, i agree that norwegian wood was amazing, ",what else was on that album?,comparison,but,mid,"well, i agree that norwegian wood was amazing, but what else was on that album?",I think they were at their peak during Rubber Soul. George was just getting into playing the sitar with Norwegian Wood and the folk influences made it a very grounded album.
"oh, there are quite a few albums that i like, ","i'd have to say ""rubber soul"" is probably my favorite.",comparison,but,mid,"oh, there are quite a few albums that i like, but i'd have to say ""rubber soul"" is probably my favorite.","I you could choose a single Beatles album as your favorite, which one would that be?"
"i think it's paul - my voice and his have always been quite similar, ",i can usually sing his parts.,contingency,so,mid,"i think it's paul - my voice and his have always been quite similar, so i can usually sing his parts. though my voice isn't as good as it used to be!",Whose harmonies are you singing?
i always thought he was the most good looking of the bunch - ,i have to say john and george were always next in line!,comparison,but,mid,i always thought he was the most good looking of the bunch - but i have to say john and george were always next in line!,Is Paul your favorite Beatle?
"it's hard to choose, ",i think that is my favorite beatles album.,comparison,but,mid,"it's hard to choose, but i think that is my favorite beatles album.","Yeah, Sgt. Peppers Lonely Hearts Club Band is a great album."
"as lyricists they are both amazing, ",i'd say i prefer mccartney singing.,comparison,but,mid,"as lyricists they are both amazing, but i'd say i prefer mccartney singing.",So do you like Paul McCartney or John Lennon more as a singer?
"nobody knows for sure, ",she probably wanted to be in the spotlight.,comparison,but,mid,"nobody knows for sure, but she probably wanted to be in the spotlight.",Wow why did she do that?
"well, it is a classic.",the best of all time?,comparison,but,begin,"well, it is a classic. but the best of all time?",Hey Jude. It's so classic!
"that's true, ","the sheer number of great albums, with the wings and with linda, like ram, surely put him first.",comparison,but,mid,"that's true, but the sheer number of great albums, with the wings and with linda, like ram, surely put him first.",I don't know. Paul has so much mediocrity and overly commercial stuff.
"well, i do think john lennon had the best solo career, ",the question of best solo beatle album is different.,comparison,but,mid,"well, i do think john lennon had the best solo career, but the question of best solo beatle album is different.","That's true, but the sheer number of great albums, with the Wings and with Linda, like Ram, surely put him first."
"that's true, ",didn't he write most of them with paul mccartney?,comparison,but,mid,"that's true, but didn't he write most of them with paul mccartney?","True, though I've always had a soft spot for John Lennon. His songwriting skills were unparalleled."
he left a few months before pete best ,he decided to return to university.,contingency,because,mid,he left a few months before pete best because he decided to return to university.,"Oh, that's interesting. And when did Stuart Sutcliffe leave?"
"their songs are certainly popular, ",i don't think that necessarily means overrated.,comparison,but,mid,"no, i don't think so. their songs are certainly popular, but i don't think that necessarily means overrated.",Do you think the Beatles are overrated?
"they're so catchy, ",also a lot of their songs sounds really psychedelic which i feel like was kind of the iconic sound of the 60's.,comparison,but,mid,"they're so catchy, but also a lot of their songs sounds really psychedelic which i feel like was kind of the iconic sound of the 60's.","Songs like ""Twist and Shout"" and ""Lucy in the Sky with Diamonds"" are my favorites."
"yea, for sure.",even today you could listen to them and still be into it.,comparison,but,begin,"yea, for sure. but even today you could listen to them and still be into it.","They're so catchy, but also a lot of their songs sounds really psychedelic which I feel like was kind of the iconic sound of the 60's."
"you don't hear too many people put that on their beatles lists, ",you're right... it is an influential album.,comparison,but,mid,"you don't hear too many people put that on their beatles lists, but you're right... it is an influential album.","I also like Revolver... that's really an underrated album, and really brought psychedelic music out of its shell."
it was different than things i had heard ,and i could understand the lyrics and loved the music.,temporal,before,mid,it was different than things i had heard before and i could understand the lyrics and loved the music.,What did you like most about it?
"yeah, george harrison wrote many songs ",paul and john usually didn't put many songs of his on the albums.,comparison,but,mid,"yeah, george harrison wrote many songs but paul and john usually didn't put many songs of his on the albums.",I didn't know George wrote that one? That's an awesome song.
"i mean it sounded good, ",i just don't think it was better than the original.,comparison,but,mid,"i mean it sounded good, but i just don't think it was better than the original.",Why not?
"it may be cliche, ",it is so good.,comparison,but,mid,"it may be cliche, but it is so good.","That is a good one. I really like another cliche one, Let it Be."
"they're all really good, ",i'm going to go with abbey road.,comparison,but,mid,"they're all really good, but i'm going to go with abbey road.  i love how the songs flow together.",No one-- that's who! What's your favorite Beatles album?
i think that was a phenomenal song ,there were betters.,comparison,but,mid,i think that was a phenomenal song but there were betters.,While my guitar gently weeps was so good.
"kind of, ",...including the change in their music style...,comparison,but,mid,"kind of, but...including the change in their music style...","Oh, you mean the whole short hair versus long-hair thing they did?"
"yeah, tragically true...","...hmmm....you know, their overall style was evolving prior to losing epstein.",comparison,but,mid,"yeah, tragically true...but...hmmm....you know, their overall style was evolving prior to losing epstein.","Well, remember...their manager Brian Epstied OD'ed around that time..."
"today everything they were doing would be considered absolutely illegal, ","back then....  all the uppers, hallucinogens, other stuff...who knows...it helped fuel some creative drive, and it wasn't really against the law yet...  but, yeah, drugs had some influence, i think.",comparison,but,mid,"they were all doing lsd and other drugs.  today everything they were doing would be considered absolutely illegal, but back then....  all the uppers, hallucinogens, other stuff...who knows...it helped fuel some creative drive, and it wasn't really against the law yet...  but, yeah, drugs had some influence, i think.","Yeah, tragically true...but...hmmm....you know, their overall style was evolving prior to losing Epstein."
"today everything they were doing would be considered absolutely illegal, but back then....  all the uppers, hallucinogens, other stuff...who knows...it helped fuel some creative drive, and it wasn't really against the law yet...  ",", yeah, drugs had some influence, i think.",comparison,but,mid,"they were all doing lsd and other drugs.  today everything they were doing would be considered absolutely illegal, but back then....  all the uppers, hallucinogens, other stuff...who knows...it helped fuel some creative drive, and it wasn't really against the law yet...  but, yeah, drugs had some influence, i think.","Yeah, tragically true...but...hmmm....you know, their overall style was evolving prior to losing Epstein."
"today everything they were doing would be considered absolutely illegal, but back then....  all the uppers, hallucinogens, other stuff...who knows...it helped fuel some creative drive, ","it wasn't really against the law yet...  but, yeah, drugs had some influence, i think.",expansion,and,mid,"they were all doing lsd and other drugs.  today everything they were doing would be considered absolutely illegal, but back then....  all the uppers, hallucinogens, other stuff...who knows...it helped fuel some creative drive, and it wasn't really against the law yet...  but, yeah, drugs had some influence, i think.","Yeah, tragically true...but...hmmm....you know, their overall style was evolving prior to losing Epstein."
"yes, yellow submarine is one, ",it's not their most influential.,comparison,but,mid,"yes, yellow submarine is one, but it's not their most influential.","Nope, like Yellow Submarine, right?"
i'm joking - ,i do love ringo.,comparison,although,mid,i'm joking - although i do love ringo.,"Wait, seriously? Or are you joking?"
i like that too ,i also like abbey road.,comparison,but,mid,i like that too but i also like abbey road.,I love The White Album.
"in fact,the song took awhile in america to be accepted ",it was different and so long.,contingency,because,mid,"in fact,the song took awhile in america to be accepted because it was different and so long.",Boy isn't that the truth.
hard to believe ,it's an iconic song now.,contingency,because,mid,hard to believe because it's an iconic song now.,"Yes,I've read that too."
"yes, especially ",he had a young son.,contingency,because,mid,"yes, especially because he had a young son. but he did leave quite a legacy.","To each their own. It is sad about John Lennon, though."
"yes, especially because he had a young son.",he did leave quite a legacy.,comparison,but,begin,"yes, especially because he had a young son. but he did leave quite a legacy.","To each their own. It is sad about John Lennon, though."
"well, that should be the case, ",they released let it be after abbey road.,comparison,but,mid,"well, that should be the case, but they released let it be after abbey road.",Abbey road is the last album where all 4 beatles were part of the recording.
but it's not ,the record company messed up.,contingency,because,mid,but it's not because the record company messed up.,That's what I'm saying It should considered the group's last recorded album.
"i could be like most people and say hey jude or i wanna hold your hand, ","i prefer some of their deeper stuff like a day in the life or side 2 of abbey road (golden slumbers, et al).",comparison,but,mid,"i could be like most people and say hey jude or i wanna hold your hand, but i prefer some of their deeper stuff like a day in the life or side 2 of abbey road (golden slumbers, et al).",What's your favorite Beatle song?
"i could be like most people and say hey jude or i wanna hold your hand, but i prefer some of their deeper stuff like a day in the life ","side 2 of abbey road (golden slumbers, et al).",expansion,or,mid,"i could be like most people and say hey jude or i wanna hold your hand, but i prefer some of their deeper stuff like a day in the life or side 2 of abbey road (golden slumbers, et al).",What's your favorite Beatle song?
"the later songs are pretty good, ",sometimes get too serious for me.,comparison,but,mid,"the later songs are pretty good, but sometimes get too serious for me. i prefer the earlier hits.","I could be like most people and say Hey Jude or I wanna hold your hand, but I prefer some of their deeper stuff like A day in the Life or side 2 of Abbey Road (Golden Slumbers, et al)."
