arg1,arg2,relation,connective,type,original_utt,original_utt_prev
i seem to recall hearing that someone was signed ,for the life of me i can;t remember who.,comparison,but,mid,i seem to recall hearing that someone was signed but for the life of me i can;t remember who.,I wonder who will play the half time show this year.
they make you go through metal detectors ,don't lock the side doors?,comparison,but,mid,they make you go through metal detectors but don't lock the side doors?,"Nope, he blended right in."
"yeah, carr is a stud, ",do you think he is worth all of that money?,comparison,but,mid,"yeah, carr is a stud, but do you think he is worth all of that money?",I think with Derek Carr signed to a new deal we are really investing into the future.
"i think he got 5 years for $125 million, which is a lot, ",he is a rising star.,comparison,but,mid,"i think he got 5 years for $125 million, which is a lot, but he is a rising star.","Yeah, Carr is a stud, but do you think he is worth all of that money?"
"it is for sure, ","he's shown so far that he handles the pressure, brings a winning attitude, and he's a leader.",comparison,but,mid,"it is for sure, but he's shown so far that he handles the pressure, brings a winning attitude, and he's a leader.","That makes him the highest paid player in the league by average salary, lot of pressure on his shoulders."
"i think he has it all to be able to lead the team to a ring, ",like i said they need more pieces.,comparison,but,mid,"no doubt. i think he has it all to be able to lead the team to a ring, but like i said they need more pieces.","It is for sure, but he's shown so far that he handles the pressure, brings a winning attitude, and he's a leader."
"yeah he is getting old, ",i think the one season break will have he refreshed and ready to go for this year.,comparison,but,mid,"yeah he is getting old, but i think the one season break will have he refreshed and ready to go for this year.","Yeah, he is one of the greatest ever for sure, his age is a bit worrying though."
"i would have to say the patriots, ",i have a few that i like.,comparison,but,mid,"i would have to say the patriots, but i have a few that i like.",What's your favorite team?
oh i agree ,they can't control that.,comparison,but,mid,oh i agree but they can't control that.,There is so much domestic violence associated with their team.
actually they can control it ,they choose not too.,comparison,but,mid,actually they can control it but they choose not too.,Oh I agree but they can't control that.
he definitely is ,still the mentality in baltimore is winning over being moral.,comparison,but,mid,he definitely is but still the mentality in baltimore is winning over being moral.,Yeah but he is a solid player.
"he completed 67% of his throws, ",he's pretty good.,contingency,so,mid,"he completed 67% of his throws, so he's pretty good.",Sounds like he has quite an arm.
"he still has time to decide, ",several people close to him have said he might want to play with usc a couple more seasons.,comparison,but,mid,"he still has time to decide, but several people close to him have said he might want to play with usc a couple more seasons.",He's going to wait for the 2019 season?
sure it's a rough sport ,that's the fun of it,comparison,but,mid,that's why they wear protective gear. sure it's a rough sport but that's the fun of it,"Football is an extremely dangerous sport, yet kids grow up wanting to be the next Peyton Manning."
that's pretty high ,it's a toll that they pay for the sport.,comparison,but,mid,that's pretty high but it's a toll that they pay for the sport.,Did you know that more than 20% of NFL players report head trauma injuries?
"drew brees is my favorite player, ",i love our coach as well.,comparison,but,mid,"drew brees is my favorite player, but i love our coach as well.",Who is your favorite player on the Saints?
"i'm more of a casual fan: i watch when it's on, ",i don't care too much.,comparison,but,mid,"i'm more of a casual fan: i watch when it's on, but i don't care too much.",Really? I didn't take you as that much of a hardcore fan.
Born a Philly fan.,they're not even the same conference.,comparison,but,begin,but they're not even the same conference.,"Right, the eastern side. Born a Philly fan."
not a fan at all.,you know a lot of players.,comparison,but,begin,but you know a lot of players.,Yep. not a fan at all.
"oh yes, they have the best work ethic ",it's fun to watch them compete in a ballroom setting.,contingency,so,mid,"oh yes, they have the best work ethic so it's fun to watch them compete in a ballroom setting.",You do seems to know a lot of plays.
i'm still a fan ,i live in cleveland and i'm loyal.,contingency,because,mid,i'm still a fan because i live in cleveland and i'm loyal.,They're pretty bad how can you still be a fan?
maybe not this ear ,definitely years to come.,comparison,but,mid,maybe not this ear but definitely years to come.,Do you think they have a chance to win it all this year?
this may be tom brady's last season ,he's got nothing to lose.,contingency,so,mid,this may be tom brady's last season so he's got nothing to lose.,And they always get an easy schedule.
"well, odell beckham has, ",its been mostly crying.,comparison,but,mid,"well, odell beckham has, but its been mostly crying.","Yea, the Giants haven't made a lot of noise lately."
"yea, great receiver, ",he needs to keep his mouth shut.,comparison,but,mid,"yea, great receiver, but he needs to keep his mouth shut.","Well, Odell Beckham has, but its been mostly crying."
"yea, he already is a great player, ",his act is annoying.,comparison,but,mid,"yea, he already is a great player, but his act is annoying.","Yea, man if that guy puts it together, he's a stud."
"i like the bears, ",they have been bad lately.,comparison,but,mid,"i like the bears, but they have been bad lately.",What is your favorite NFL team?
"tough call, ",i have to go with the super bowl comeback by the patriots.,comparison,but,mid,"tough call, but i have to go with the super bowl comeback by the patriots.","Which game was crazier the Cowboys and Packers, or Patriots and Falcons?"
"they do have a couple of great safeties, ",time will tell if that is enough.,comparison,but,mid,"they do have a couple of great safeties, but time will tell if that is enough.","Come to think of it, I can't name any of their cornerbacks."
no it's probably been more recent than that.,"they don't give up, they just keep going.",comparison,but,begin,"no it's probably been more recent than that.  but they don't give up, they just keep going.",No surely it hasn't been that long!
"they are truly the underdogs and when they finally do win the super bowl, ","even get to go, it's going to be epic.",expansion,or,mid,"that's true.  they are truly the underdogs and when they finally do win the super bowl, or even get to go, it's going to be epic.",Yeah you have to admire their stamina despite almost always losing.
"it might, ",i wouldn't get your hopes up.,comparison,but,mid,"i don't see that ever happening. it might, but i wouldn't get your hopes up.","That's true.  They are truly the underdogs and when they finally do win the super bowl, or even get to go, it's going to be epic."
he is just observing ,he hasn't been released yet.,contingency,because,mid,no. he is just observing because he hasn't been released yet.,Is he even practicing yet at camp?
"well brady probably doesn't have many years left, ",i'm sure they can find someone else.,comparison,but,mid,"well brady probably doesn't have many years left, but i'm sure they can find someone else.",Especially being in the same conference as the Patriots.
Maybe I'll hear from the shop on Friday.,friday is after thanksgiving day!,comparison,but,begin,but friday is after thanksgiving day!  how are we going to watch the detroit lions and the dallas cowboys play football if our television if broken?,Yeah. Maybe I'll hear from the shop on Friday.
you can stop crying now ,i rented a 56-inch plasma tv from rent-a-center for thursday.,contingency,because,mid,"you can stop crying now because i rented a 56-inch plasma tv from rent-a-center for thursday. i am smart enough to know that if you didn't get to see football on turkey day, then you would not let anybody else digest any of this food all day.",This is the worst!  This may be the worst Turkey Day ever!
"yeah, i don't keep up with the draft ",i always look over the rosters to see big changes.,comparison,but,mid,"yeah, i don't keep up with the draft but i always look over the rosters to see big changes.",Did you check out the rosters at all afterwards?
"geno may get less now, ",he's on a better team.,comparison,but,mid,"geno may get less now, but he's on a better team.",He's young enough to bounce back on another team.
the raider fans have been through it before ,the charger fans must be crushed.,comparison,but,mid,i feel sorry for the fans. the raider fans have been through it before but the charger fans must be crushed.,What do you think about the Chargers and Raiders both moving to new cities?
the raider fans have been through it ,but the charger fans must be crushed.,temporal,before,mid,i feel sorry for the fans. the raider fans have been through it before but the charger fans must be crushed.,What do you think about the Chargers and Raiders both moving to new cities?
i haven't heard ,i'll let you know if i see something.,comparison,but,mid,i haven't heard but i'll let you know if i see something. what do you think about john lynch going to san francisco?,I wonder what the Raiders are going to do?
"i can't argue with that, ",he is all they got!!,comparison,but,mid,"i can't argue with that, but he is all they got!!!","Yup, best QB in the league"
"lions always seem on the verge of being good, ",just stay mediocre.,comparison,but,mid,"lions always seem on the verge of being good, but just stay mediocre.","I wish Detroit would get it together, they have a decent QB"
i guess.,turnovers are always a huge problem for us.,comparison,but,begin,i guess. but turnovers are always a huge problem for us.,True but a very good offense like ours can pick up the slack left by defense.
"well i do not know about undefeated, ",i can see 14 wins happening.,comparison,but,mid,"well i do not know about undefeated, but i can see 14 wins happening.","Yes, we will at least win 14 games, maybe even undefeated this season."
"yes, they will be good, ",we will be better.,comparison,but,mid,"yes, they will be good, but we will be better.","Well I am worried about the Patriots, Seahawks and Raiders this season."
"i'm not sure how that's going to go to be honest, ",i hope they beat the patriots.,comparison,but,mid,"yeah, dude.  i'm not sure how that's going to go to be honest, but i hope they beat the patriots.",Didn't he sign with the Raiders this year?
"i don't want to get too hopeful, ",yeah i think that's a safe bet.,comparison,but,mid,"i don't want to get too hopeful, but yeah i think that's a safe bet.","Hey, your Browns had a pretty solid off-season!  Do you think they will win more than one this year?"
"i like the denver broncos i was so upset when manning retired, ",he was at the age it wasn't worth the risk.,comparison,but,mid,"i like the denver broncos i was so upset when manning retired, but he was at the age it wasn't worth the risk.",I love the Pittsburgh Steelers what is your favorite team?
"yeah he was a little over the normal retirement age for football players, ",he is still active in football.,comparison,but,mid,"yeah he was a little over the normal retirement age for football players, but he is still active in football.","I like the Denver Broncos I was so upset when Manning retired, but he was at the age it wasn't worth the risk."
yeah he did a lot of those commercials ,he was the safety for the steelers.,comparison,but,mid,yeah he did a lot of those commercials but he was the safety for the steelers. one of the best safety's there was.,Hey he was the head and shoulders guy I loved those commercials.
he writes movie reviews on his twitter ,"he was in the new disney movie moana, was cast as man one.",comparison,but,mid,"he writes movie reviews on his twitter but he was in the new disney movie moana, was cast as man one.",What is he up to since he retired?
i haven't looked at his stats ,i'm sure he'll do great in denver.,comparison,but,mid,i haven't looked at his stats but i'm sure he'll do great in denver.,I think Garett Bolles was a great pick we really needed a new offensive tackle.
we can play a bit in the backyard ,we were just gonna watch.,comparison,but,mid,we can play a bit in the backyard but we were just gonna watch.,"Cool, are you guys playing or just watching?"
i heard that ,"he is an expensive guy, we will see what happens to the team.",comparison,but,mid,"i heard that but he is an expensive guy, we will see what happens to the team.",Did you hear the Redskins want to keep Kirk Cousins?
that's great ,i like the steelers too.,contingency,because,mid,that's great because i like the steelers too.,We will see what next season brings. My favorite team the Steelers have a real shot.
"yea, that guy is a playmaker, ",he has to stay healthy.,comparison,but,mid,"yea, that guy is a playmaker, but he has to stay healthy.","Yea, they added Desean and that should help."
"tampa should be able to make some noise this year, ",it may not be enough.,comparison,but,mid,"tampa should be able to make some noise this year, but it may not be enough.","Yea, that guy is a playmaker, but he has to stay healthy."
i grew up in vikings territory ,i'm a vikings fan.,contingency,so,mid,i grew up in vikings territory so i'm a vikings fan.,I was a diehard Cowboys fan my whole life and still am even though I don't really watch it.
i just got sick of everyone liking them ,they are the local team even though they don't like football.,contingency,because,mid,i just got sick of everyone liking them because they are the local team even though they don't like football.,"Really, how come?"
the falcons was a good team ,"not great, they always die in the second half of a game.",comparison,but,mid,"the falcons was a good team but not great, they always die in the second half of a game.",You don't believe The Falcons was a great team?
they are both great players ,russell wilson has a slight edge over cam.,comparison,but,mid,they are both great players but russell wilson has a slight edge over cam.,Do you think Russell Wilson is a better quarterback than Cam Newton?
cousins is good ,he needs more help from his teammates.,comparison,but,mid,cousins is good but he needs more help from his teammates.,Okay. How would you rate The Redskins quarterback Cousins?
that's a fair point.,"it's only speculation, and one reason at that!",comparison,but,begin,"that's a fair point. but it's only speculation, and one reason at that!",A lot of quarterbacks regress a good deal in their second NFL season as defenses adjust to them. Remember Colin Kaepernick?
i know we had people leave in the off-season ,i didn't realize it was that many.,comparison,but,mid,oh wow. i know we had people leave in the off-season but i didn't realize it was that many.,"Well, the Cowboys also lost a great deal of players on defense. I think 4 of the starters in the secondary left during free agency?"
"youll see adjustments to our lines once information comes out, ",you still need to be careful; lousy weather doesnt always = under.,comparison,but,mid,"by getting early information. youll see adjustments to our lines once information comes out, but you still need to be careful; lousy weather doesnt always = under. weve been burned by that misconception more than a few times",How can I use the weather information to make better totals bets?
"it can be more value for those that take the time to evaluate and analyze, ",it can also be concerning for those taking shots in the dark or making assumptions,comparison,but,mid,"it can be more value for those that take the time to evaluate and analyze, but it can also be concerning for those taking shots in the dark or making assumptions",Do you think that provides more value for bettors or more concerns?
it can be more value for those that take the time to evaluate ,"analyze, but it can also be concerning for those taking shots in the dark or making assumptions",expansion,and,mid,"it can be more value for those that take the time to evaluate and analyze, but it can also be concerning for those taking shots in the dark or making assumptions",Do you think that provides more value for bettors or more concerns?
"teams in high-population markets with good teams can move the markets, ","our clientele is sharper than the average sportsbooks, so our lines wont move as much in that way.",comparison,but,mid,"thats tricky. teams in high-population markets with good teams can move the markets, but our clientele is sharper than the average sportsbooks, so our lines wont move as much in that way.",How much does a teams popularity factor into markets? Enough to move handicaps?
"teams in high-population markets with good teams can move the markets, but our clientele is sharper than the average sportsbooks, ",our lines wont move as much in that way.,contingency,so,mid,"thats tricky. teams in high-population markets with good teams can move the markets, but our clientele is sharper than the average sportsbooks, so our lines wont move as much in that way.",How much does a teams popularity factor into markets? Enough to move handicaps?
"it depends on he spread thoughif you have the broncos as a 14-point favourite, our clientele know there may be value on the dog ",of the inflated line.,contingency,because,mid,"its what youd expect. teams that make the superbowl, that have national brands, that are fun to watch. it depends on he spread thoughif you have the broncos as a 14-point favourite, our clientele know there may be value on the dog because of the inflated line.",Which teams get the biggest bumps that way?
"i dont think it affects the spread much because its a two-way game, ",you may see an increase in the total points scored per game.,comparison,but,mid,"thats a good questionhadnt really considered it. i dont think it affects the spread much because its a two-way game, but you may see an increase in the total points scored per game. well watch that through the season and see if it has an effect, and whether its called as much as in pre-season.",How does stronger enforcement of pass interference/illegal contact impact week 1 lines?
i dont think it affects the spread much ,"its a two-way game, but you may see an increase in the total points scored per game.",contingency,because,mid,"thats a good questionhadnt really considered it. i dont think it affects the spread much because its a two-way game, but you may see an increase in the total points scored per game. well watch that through the season and see if it has an effect, and whether its called as much as in pre-season.",How does stronger enforcement of pass interference/illegal contact impact week 1 lines?
you pay an elite back ,there are not alot of them.,contingency,because,mid,i dont agree. you pay an elite back because there are not alot of them.,They got McFadden to 1000 yards the year before. Its all about the line.
of course!,"he says hes a ""new york"" fan",comparison,although,begin,"of course! although he says hes a ""new york"" fan",Ohh. Does your grandpa like the Giants?
not only do they have to play on christmas ,they also have to travel.,comparison,but,mid,no. not only do they have to play on christmas but they also have to travel. they are playing houston.,Are they at home at least?
"five primetime games are scheduled, and the playoffs will be televised, ",of course they will be in those!,contingency,so,mid,"yes, of course. five primetime games are scheduled, and the playoffs will be televised, so of course they will be in those!",Are they going to be on television this season?
"yeah that's true, ",nothing will change the fact that they still don't have a quarterback.,comparison,but,mid,"yeah that's true, but nothing will change the fact that they still don't have a quarterback.",Really? Even the niners? They had a great draft and Kyle Shanahan is going to be a great fit.
"well yeah, they have to play the afc south ",they're bound to win a few of those.,contingency,so,mid,"well yeah, they have to play the afc south so they're bound to win a few of those. i give them 6 wins.","Even so, I think the niners will surprise a lot of people. I'm thinking at least 8 wins this year."
because they have to play the rest of the nfc west 6 times ,those are basically a guaranteed loss - save the rams maybe.,expansion,and,mid,because they have to play the rest of the nfc west 6 times and those are basically a guaranteed loss - save the rams maybe.,Why only 6?
"haha yeah, i'm not sure what the bears were thinking, ",i will admit that the niners did have some good picks.,comparison,but,mid,"haha yeah, i'm not sure what the bears were thinking, but i will admit that the niners did have some good picks.","Well like I said, they killed it at the draft. I can't believe the Bears traded up for a pick that the niners weren't even going to make."
i think they have some good pieces ,not sure they are ready to take the next step.,comparison,but,mid,i think they have some good pieces but not sure they are ready to take the next step.,Can the Jaguars finally put together a good season?
hes really fun to watch ,i think theyll keep him out just to be safe so he doesnt get injured.,comparison,but,mid,i hope so.  hes really fun to watch but i think theyll keep him out just to be safe so he doesnt get injured.,Will Teddy Bridgewater play this year?
hes really fun to watch but i think theyll keep him out just to be safe ,he doesnt get injured.,contingency,so,mid,i hope so.  hes really fun to watch but i think theyll keep him out just to be safe so he doesnt get injured.,Will Teddy Bridgewater play this year?
evan engram is good ,he's just a tight end.,comparison,but,mid,i agree. evan engram is good but he's just a tight end.,"Yeah, how much could that possibly contribute?"
Evan Engram is good but he's just a tight end.,", i feel like teams can't always make the huge, game-changing draft picks.",comparison,although,begin,"although, i feel like teams can't always make the huge, game-changing draft picks.",I agree. Evan Engram is good but he's just a tight end.
whatever - that's an easy no-brainer pick.,they are a great team.,comparison,but,begin,whatever - that's an easy no-brainer pick.  but they are a great team.,Of course I have to go with my AFC team - the Patriots.
i agree they are - mainly ,they are also good and play well every year and the game outcome is always up for grabs.,contingency,because,mid,i agree they are - mainly because they are also good and play well every year and the game outcome is always up for grabs.,I appreciate how great they are and yet my team the Broncos are probably their biggest rivals.
"me too, ",i miss the old my team above all and loyalty now and then.,comparison,but,mid,"me too, but i miss the old my team above all and loyalty now and then.","Over all its ok though. I for one prefer the rivalry based upon competition, good play and outcome up for grabs."
"not at all, you see mike glennon and josh mccown ",thats because they are backups only.,comparison,but,mid,"not at all, you see mike glennon and josh mccown but thats because they are backups only.",Yeah you dont see most of them hit free agency
"not at all, you see mike glennon and josh mccown but thats ",they are backups only.,contingency,because,mid,"not at all, you see mike glennon and josh mccown but thats because they are backups only.",Yeah you dont see most of them hit free agency
no actually i like the cowboys ,"my family comes from ohio, and i have grown up a browns fan",comparison,but,mid,"no actually i like the cowboys but my family comes from ohio, and i have grown up a browns fan",Oh wow Texas huh?  So are you a Cowboys fan?
thats true but they have had a lot of draft picks recently ,we feel optimistic that things will change under head coach hugh jackson.,expansion,and,mid,thats true but they have had a lot of draft picks recently and we feel optimistic that things will change under head coach hugh jackson.,They haven't had a good team since the Bernie Kosar Years in the mid 80's
"that's great, ",i really love an outdoor nfl game.,comparison,but,mid,"that's great, but i really love an outdoor nfl game.",I think it was just built for the Vikings this past year.
"yes, my kids love the games ",it can get so bitterly cold that we have to leave.,comparison,but,mid,"yes, my kids love the games but it can get so bitterly cold that we have to leave.","Yes, probably good if you want to take kids to the game."
"i agree, hopefully they get taken out early and not make the superbowl ",we can see new teams.,contingency,so,mid,"i agree, hopefully they get taken out early and not make the superbowl so we can see new teams.","Well, I'll be happy as long as the Patriots don't win again, I really don't like their arrogance."
"yep, i kind of want them to miss the post season, ",more likely they win more than 12 games again this season.,comparison,but,mid,"yep, i kind of want them to miss the post season, but more likely they win more than 12 games again this season.","I agree, hopefully they get taken out early and not make the Superbowl so we can see new teams."
"i do, ",don't forget that this is not college football anymore.,comparison,but,mid,"i do, but don't forget that this is not college football anymore.",I've been following since he started at LSU; trust me on this.
"that is true, ",his dad played in the nfl.,comparison,but,mid,"that is true, but his dad played in the nfl.","I do, but don't forget that this is not college football anymore."
