arg1,arg2,relation,connective,type,original_utt,original_utt_prev
i don't know ,i'm excited to see.,comparison,but,mid,i don't know but i'm excited to see.,How do you think Drew Brees will do this season?
we have some pretty decent commitments ,we'll see!,contingency,so,mid,i hope so. we have some pretty decent commitments so we'll see!,Can the Saints go all the way this year?
he's great ,i do think there's better.,comparison,but,mid,he's great but i do think there's better. i'd love to say drew brees but last season was awful!,They're saying Aaron Rodgers is the best QB in the NFL. Do you agree?
i'd love to say drew brees ,last season was awful!,comparison,but,mid,he's great but i do think there's better. i'd love to say drew brees but last season was awful!,They're saying Aaron Rodgers is the best QB in the NFL. Do you agree?
"they might take advantage of certain things, ",that didn't make them win the sb.,comparison,but,mid,"they might take advantage of certain things, but that didn't make them win the sb.",But it's funny that they keep finding out new ways they game the system.
"i didn't think so at one time, ",i'm not sure i can argue otherwise.,comparison,but,mid,"i didn't think so at one time, but i'm not sure i can argue otherwise.",Greatest QB ever.
"guy's ancient, like 40 years old, ",he's still in his prime.,comparison,but,mid,"guy's ancient, like 40 years old, but he's still in his prime.","I didn't think so at one time, but I'm not sure I can argue otherwise."
"he may not have the records, ",he's got the rings.,comparison,but,mid,"no, greatest.  he may not have the records, but he's got the rings.",He's just a great player.
"that is true, ",they have all the pieces in place.,comparison,but,mid,"that is true, but they have all the pieces in place. i wish they would stop blowing draft picks on thug players though.",Really? It seems like they always figure out how to screw it up.
I don't like that and I'm sure they don't either.,"there are the two teams that play in ""new york"" - but actually play in new jersey",comparison,but,begin,"but there are the two teams that play in ""new york"" - but actually play in new jersey",I don't see the two in LA as a feasible thing forever. I don't like that and I'm sure they don't either.
"but there are the two teams that play in ""new york"" - ",actually play in new jersey,comparison,but,mid,"but there are the two teams that play in ""new york"" - but actually play in new jersey",I don't see the two in LA as a feasible thing forever. I don't like that and I'm sure they don't either.
"that's true, they share a stadium and such, ",the jets aren't good.,comparison,but,mid,"that's true, they share a stadium and such, but the jets aren't good.","But there are the two teams that play in ""New York"" - but actually play in New Jersey"
"that's also true, ",the rams haven't been good for a very long time either.,comparison,but,mid,"that's also true, but the rams haven't been good for a very long time either. the chargers aren't good either right now.","That's true, they share a stadium and such, but the Jets aren't good."
the vegas move shocked me ,they have one of the most reputable fan bases in the world.,contingency,because,mid,the vegas move shocked me because they have one of the most reputable fan bases in the world.,"That's also true, but the Rams haven't been good for a very long time either. The Chargers aren't good either right now."
"yeah, vegas just got a hockey team too, ","i'm not really sure what is so big about vegas, the city doesn't impress me that much.",contingency,so,mid,"yeah, vegas just got a hockey team too, so i'm not really sure what is so big about vegas, the city doesn't impress me that much.",The Vegas move shocked me because they have one of the most reputable fan bases in the world.
"i suppose it is good for the raiders, because they will sell out every game with tourists from elsewhere, ",they do abandon one of the most blueblood fan bases and loyal fanbases too!,comparison,but,mid,"i suppose it is good for the raiders, because they will sell out every game with tourists from elsewhere, but they do abandon one of the most blueblood fan bases and loyal fanbases too!","Yeah, Vegas just got a hockey team too, so I'm not really sure what is so big about Vegas, the city doesn't impress me that much."
"i suppose it is good for the raiders, ","they will sell out every game with tourists from elsewhere, but they do abandon one of the most blueblood fan bases and loyal fanbases too!",contingency,because,mid,"i suppose it is good for the raiders, because they will sell out every game with tourists from elsewhere, but they do abandon one of the most blueblood fan bases and loyal fanbases too!","Yeah, Vegas just got a hockey team too, so I'm not really sure what is so big about Vegas, the city doesn't impress me that much."
"yeah, i guess i can see that.","if you think about it, it really is all about being part of a great system.",comparison,but,begin,"yeah, i guess i can see that. but if you think about it, it really is all about being part of a great system.",I just think that he gets carried by his team too much and never really plays a great Super Bowl where he dominates.
i actually think they should start him soon and cut brady ,jimmy is about to become a free agent.,contingency,because,mid,i actually think they should start him soon and cut brady because jimmy is about to become a free agent.,"Yeah, I think he's pretty good, too."
"i don't think he'll have any effects from the concussions, ",he is getting old.,comparison,but,mid,"i don't think he'll have any effects from the concussions, but he is getting old.","Tom Brady's had several concussions, do you think he's still going to be any good?"
"kind of early, ",he was having a lot of trouble with his knees.,comparison,but,mid,"kind of early, but he was having a lot of trouble with his knees.","Okay, I remember him. Didn't he retire early?"
"this might be controversial, ",dallas cowboys dak prescott had an excellent rookie year,comparison,but,mid,"this might be controversial, but dallas cowboys dak prescott had an excellent rookie year",who else do you think should make the best of 2016 list
he would be even more awesome ,he can't run,comparison,but,mid,he would be even more awesome but he can't run,imagine if he had speed and could run
"agreed, they didn't really have playoff experience last year ",should go further this year,comparison,but,mid,"agreed, they didn't really have playoff experience last year but should go further this year",they have a great qb and rb they should be right up there
that's why i try not to use players when they play us ,it's kinda difficult,comparison,but,mid,that's why i try not to use players when they play us but it's kinda difficult,"yes me too, the only problem is when you have to cheer on players when they play the pats"
yes go pats  ,no problem getting to the superbowl again this year,comparison,but,mid,yes go pats  but no problem getting to the superbowl again this year,sounds like a plan .....GO PATS lol
i couldn't agree more we are spoiled fans ,that's fine with me,comparison,but,mid,i couldn't agree more we are spoiled fans but that's fine with me,yes GO PATS  but no problem getting to the superbowl again this year
"that kinda makes sense, the reason for trade is ",your performance goes down,contingency,because,mid,"that kinda makes sense, the reason for trade is because your performance goes down",Not common. Peyton Manning is the very first QB to win the superbowl playing for two different teams.
"yep, but he also lost 2, ",his percentage of winning the superbowl isn't as high as bradshaw or montana who both went to the superbowl 4 times and won all 4.,contingency,so,mid,"yep, but he also lost 2, so his percentage of winning the superbowl isn't as high as bradshaw or montana who both went to the superbowl 4 times and won all 4.",So he went to the superbowl more than anyone. and won the superbowl more than anyone
"yep, but he also lost 2, so his percentage of winning the superbowl isn't as high as bradshaw ",montana who both went to the superbowl 4 times and won all 4.,expansion,or,mid,"yep, but he also lost 2, so his percentage of winning the superbowl isn't as high as bradshaw or montana who both went to the superbowl 4 times and won all 4.",So he went to the superbowl more than anyone. and won the superbowl more than anyone
"i watched them a bit, ",think they have a lot of issues.,comparison,but,mid,"i watched them a bit, but think they have a lot of issues.",What do you think about the Detroit Lions next season?
"matthew stafford is good, ",he does too much.,comparison,but,mid,"matthew stafford is good, but he does too much.",What about the quarterback?
"he is definitely a great kicker, ",not necessarily the best in the league.,comparison,although,mid,"he is definitely a great kicker, although not necessarily the best in the league.",That's what I'm talking about!
"he may have been a good college coach, ",he was a terrible pro coach.,comparison,but,mid,"he may have been a good college coach, but he was a terrible pro coach.","Yes, thank goodness for us fans."
"i know, ",i need to see more from him before i believe it.,comparison,but,mid,"i know, but i need to see more from him before i believe it.",Nelson Agalhor has looked good in workouts too.
"i don't think he will ever be more than a slot option, ",i am just hoping he won't be a first round bust forever,comparison,but,mid,"i don't think he will ever be more than a slot option, but i am just hoping he won't be a first round bust forever","I know, but I need to see more from him before I believe it."
"that's true, ",i hate them so much.,comparison,but,mid,"that's true, but i hate them so much.","Their defense, man. That is a sick unit that will keep them in games all year."
bellicheck is a great coach ,a horrible dude.,comparison,but,mid,totally with you! bellicheck is a great coach but a horrible dude.,Couldn't have happened to a better bunch. Those Pats are cheaters.
"eight and eight, ","if one of the teams get hot, they could end up ten and six.",comparison,but,mid,"eight and eight, but if one of the teams get hot, they could end up ten and six.",Mediocre is right. They are basically eight and eight teams.
"i guess my final prediction is cowboys 12 and 4, giants 9 ","7, eagles 7 and 9, redskins 6 and 10.",expansion,and,mid,"i could agree. i guess my final prediction is cowboys 12 and 4, giants 9 and 7, eagles 7 and 9, redskins 6 and 10.",This will probably be a year where both teams are out this year.
"well, the quarterbacks have the biggest impact these days, ",they are not the best athletes.,comparison,but,mid,"well, the quarterbacks have the biggest impact these days, but they are not the best athletes.",Why is that?
"he might be right, ","since we didn't see him that much, let's eliminate him from the discussion.",comparison,but,mid,"he might be right, but since we didn't see him that much, let's eliminate him from the discussion.","Well, Jim Brown would say it is Jim Brown."
"dickerson has the most yards, ",i was never a big fan.,comparison,but,mid,"agreed.  dickerson has the most yards, but i was never a big fan.","Well, if all the games we're on artificial turf, I'd go with Barry Sanders."
"yeah, big and powerful, ",the elusive backs are more fun.,comparison,but,mid,"yeah, big and powerful, but the elusive backs are more fun.","Agreed.  Dickerson has the most yards, but I was never a big fan."
"he gave up a lead to a better team, ",against brady his stats and skills match up well.,comparison,but,mid,"he gave up a lead to a better team, but against brady his stats and skills match up well.","That is absolute tomfoolery man, how can he be the best when he gave up a lead like that?"
"he can get those completions, ",i was really a cowboys fan last season.,comparison,but,mid,"he can get those completions, but i was really a cowboys fan last season.",He was one of the most entertaining quarterbacks of last year.
maybe it was all thrown at him a bit early ,he will surely come back better!,comparison,but,mid,maybe it was all thrown at him a bit early but he will surely come back better!,Yeah but he was a bit young and took on too much.
"well, it's a weak division, ",there's a chance.,contingency,so,mid,"well, it's a weak division, so there's a chance.",Think we will win the division?
"i completely agree, ",you also need playmakers and i'm just not sure rodgers has that anymore.,comparison,but,mid,"i completely agree, but you also need playmakers and i'm just not sure rodgers has that anymore.","You're right. With a top 3 quarterback, you can always be in contention."
"well, he has some guys to throw to, ",i'm not sure if they can stop anybody.,comparison,but,mid,"well, he has some guys to throw to, but i'm not sure if they can stop anybody.","I completely agree, but you also need playmakers and I'm just not sure Rodgers has that anymore."
"yea, it is a shame ",brees isn't getting any younger.,contingency,because,mid,"yea, it is a shame because brees isn't getting any younger.","Yea, it has been. They have made very little effort to improve that defense."
"yea, they did add adrian peterson, ",it seems like he is washed up anyway.,comparison,but,mid,"yea, they did add adrian peterson, but it seems like he is washed up anyway.","Yea, it is a shame because Brees isn't getting any younger."
well that is ,dree brees is their quarter back.,contingency,because,mid,well that is because dree brees is their quarter back.,No and your husbands favorite team the Saints have only won one Superbowl.
we need to get tickets ,we can take our hubbys to the game.,contingency,so,mid,we need to get tickets so we can take our hubbys to the game.,Now i understand better.
"i grew up in new york, ",i've always been a giants fan.,contingency,so,mid,"i grew up in new york, so i've always been a giants fan.",Who's your favorite team?
"josh mccown probably, ",who knows for sure.,comparison,but,mid,"josh mccown probably, but who knows for sure.",Who's going to be the quarterback this year?
"i'd like to think so, ",i'm not holding out much hope.,comparison,but,mid,"i'd like to think so, but i'm not holding out much hope.",Maybe one of your recent draft choices can be the man.
the doplhins suck ,it's just going to be cool to expierence an nfl game overseas.,comparison,but,mid,eh it's whatever. the doplhins suck but it's just going to be cool to expierence an nfl game overseas.,Dude you have no idea. Kinda wish we were playing a better team though.
most likely 2 or 3 ,"who knows, he could get hurt before that.",comparison,but,mid,"most likely 2 or 3 but who knows, he could get hurt before that.",How more years do think Drew Brees has left?
i wasn't too impressed with some of our later 5 and 6th picks ,overall i thought mikey loomis did okay.,comparison,but,mid,i wasn't too impressed with some of our later 5 and 6th picks but overall i thought mikey loomis did okay.,We did draft a bunch of defensive players in the draft this year.
i wouldn't doubt it ,"you gotta give sean payton some credit, he's a genius and a great coach.",comparison,but,mid,"ha. i wouldn't doubt it but you gotta give sean payton some credit, he's a genius and a great coach.",Yeah same. I think Sean Payton is making most calls in regards to drafting. Loomis is just a front.
i would too.,it's going to be odd buying a jersey with a logo from a corporation on it.,comparison,but,begin,i would too. but it's going to be odd buying a jersey with a logo from a corporation on it.,I would actually be for that if it meant shorter NFL games with less commercials.
if it means i can go to bed at a reasonable time ,"i don't have to watch a four hour game, then it's fine with me.",contingency,because,mid,"if it means i can go to bed at a reasonable time because i don't have to watch a four hour game, then it's fine with me.",I would too. But it's going to be odd buying a jersey with a logo from a corporation on it.
"a shame, ",i can understand why it happened.,comparison,but,mid,"a shame, but i can understand why it happened.",What do you think about their recently retired players??
"good choices, ",almost too typical.,comparison,but,mid,"good choices, but almost too typical.",I think Seattle and New England will be there again.
"they've got more than that man, i'm not a chiefs fan, ",i'm not going to deny talent.,comparison,but,mid,"they've got more than that man, i'm not a chiefs fan, but i'm not going to deny talent.","Yeah, but a team isn't going to succeed with a good Tight End and a decent running back."
i'll give you that.,doesn't make them good.,comparison,but,begin,i'll give you that. but doesn't make them good.,"No he's not, he's much better now than when he was on the Eagles."
"for sure, ",i still feel bad for the guy a little bit.,comparison,but,mid,"for sure, but i still feel bad for the guy a little bit. remember the choice between leaf and manning.",He brought a lot of it on himself with his attitude and locker room conduct.
i do not have a favorite team ,it i did it would be the eagles i guess.,comparison,but,mid,i do not have a favorite team but it i did it would be the eagles i guess.,I think football is exciting. The Cowboys are my favorite team.
"he was a bit of a wildcard, ",he has been very good.,comparison,but,mid,"definitely! he was a bit of a wildcard, but he has been very good.",Oh I see. Hasn't he been pretty good for the Redskins?
"i'm a big cowboys fan, ",i'm trying to plan a trip to go see them.,contingency,so,mid,"of course. i'm a big cowboys fan, so i'm trying to plan a trip to go see them.","Exactly, hopefully it'll work out. Are you planning on going to any games this year?"
well i know the media will tell you tom brady ,i think thats debatable,comparison,but,mid,well i know the media will tell you tom brady but i think thats debatable,who do you thnk is the GOAT?
okay i can see where you are coming from ,that guy is a jerk,comparison,but,mid,okay i can see where you are coming from but that guy is a jerk,"lol yes he is, I would probably also include Big Ben"
yeah aaron is good ,i think eli manning should be included,comparison,but,mid,yeah aaron is good but i think eli manning should be included,I would say Aaron Rodgers
"well, i guess i don't totally disagree with that.",", i mean he still produces pretty well, and the steelers do have some younger talent that is pretty impressive.",comparison,but,begin,"well, i guess i don't totally disagree with that. but, i mean he still produces pretty well, and the steelers do have some younger talent that is pretty impressive.","I'm not as sure about that as I once was. I think Big Ben isn't what he used to be, and is really starting to show his age."
"it's just that they have always been a real ""leadership-needy"" kind of team to me, ","if a lot of that leadership comes from ben, and he is starting to slow down, that could not be good news.",expansion,and,mid,"oh, no, you're right about that. it's just that they have always been a real ""leadership-needy"" kind of team to me, and if a lot of that leadership comes from ben, and he is starting to slow down, that could not be good news.","Well, I guess I don't totally disagree with that. But, I mean he still produces pretty well, and the Steelers do have some younger talent that is pretty impressive."
"it's just that they have always been a real ""leadership-needy"" kind of team to me, and if a lot of that leadership comes from ben, ","he is starting to slow down, that could not be good news.",expansion,and,mid,"oh, no, you're right about that. it's just that they have always been a real ""leadership-needy"" kind of team to me, and if a lot of that leadership comes from ben, and he is starting to slow down, that could not be good news.","Well, I guess I don't totally disagree with that. But, I mean he still produces pretty well, and the Steelers do have some younger talent that is pretty impressive."
"yeah, i think you're right.","besides the steelers, i am pretty excited about texas football this season; i think the cowboys and the texans can both be good.",comparison,but,begin,"yeah, i think you're right. but besides the steelers, i am pretty excited about texas football this season; i think the cowboys and the texans can both be good.","Ok, I see your point there. I guess we will have to just wait and see if it actually is a problem on the field."
i enjoy watching phillip rivers on tv ,i'm fine with that also.,contingency,so,mid,i enjoy watching phillip rivers on tv so i'm fine with that also.,It will be hard to get tickets! They are expensive.
"i can't say, ",it seems to be good for business.,comparison,but,mid,"i can't say, but it seems to be good for business.",Would that be good for the team?
"yea, i agree, ",denver has to be at the top of the list.,comparison,but,mid,"yea, i agree, but denver has to be at the top of the list.","Yea, Seattle may be one and Green Bay may be another."
"yea, they are lucky he turned out okay, ",still not good enough.,comparison,but,mid,"yea, they are lucky he turned out okay, but still not good enough.",That could have been a distaster.
"well, now the buzz is that brady is.",i think there is some debate about this.,comparison,but,begin,"well, now the buzz is that brady is. but i think there is some debate about this.",Who do you think is the G.O.A.T. (Greatest of all-time)?
"interestingly, it seemed like jerry rice was on that short list ",his stock seemed to have gone down a bit.,comparison,but,mid,"definitely brady, montana, jim brown. interestingly, it seemed like jerry rice was on that short list but his stock seemed to have gone down a bit.",Who would make your short list
"yeah, you can even see that in the nfl draft a bit.","getting back to the debate, it's really hard to be objective about brady lately",comparison,but,begin,"yeah, you can even see that in the nfl draft a bit. but getting back to the debate, it's really hard to be objective about brady lately",And by that logic positions like RB and Wide Receiver have just gone down in importance.
"well, here's what i think would push him over the top: super bowl rings ",the fact that he wasn't always surrounded by top-notch talent.,expansion,and,mid,"well, here's what i think would push him over the top: super bowl rings and the fact that he wasn't always surrounded by top-notch talent.",But I think the dust needs to settle a bit before anyone makes that proclamation.
i think montana is in the discussion ,his record in super bowls is perfect.,contingency,because,mid,"i think montana is in the discussion because his record in super bowls is perfect. also, i know a lot of old-timers say jim brown was the most impressive player they'd every saw.",What is the argument against?
"well, i think the jim brown argument -- if you are going to go that route -- would not have to be based on stats ",based on observing him play.,comparison,but,mid,"well, i think the jim brown argument -- if you are going to go that route -- would not have to be based on stats but based on observing him play.","I think Montana is in the discussion because his record in Super Bowls is perfect. Also, I know a lot of old-timers say Jim Brown was the most impressive player they'd every saw."
"yeah, and i think the number of people who first-hand witnessed him are obviously dwindling.",his stats were very impressive.,comparison,although,begin,"yeah, and i think the number of people who first-hand witnessed him are obviously dwindling. although his stats were very impressive.","Well, I think the Jim Brown argument -- if you are going to go that route -- would not have to be based on stats but based on observing him play."
no it usually  gets played on local networks ,sometimes it depends on the large net work if they are going to play it.,comparison,but,mid,no it usually  gets played on local networks but sometimes it depends on the large net work if they are going to play it.,I guess it depends on what their ranking is going into this season  to who gets  televised maybe?
i am glad i am not a football fan ,it always made me mad when a game wasn't televised.,contingency,because,mid,i am glad i am not a football fan because it always made me mad when a game wasn't televised.,oh yes it's all about the money and not for the love of the game.
i never saw it ,the game was blacked out where i was living!,contingency,because,mid,"i never saw it because the game was blacked out where i was living!  so, after that game, i was a bills fan in the lonestar state...with a target on my back!",That was a good game!
"i guess i am tough on him because people always say that he should not just win the defensive player of the year award, ",also the regular season mvp award too.,comparison,but,mid,"i guess i am tough on him because people always say that he should not just win the defensive player of the year award, but also the regular season mvp award too.",That's not his fault! He's only a defensive end and can't control the game like a quarterback.
i guess i am tough on him ,"people always say that he should not just win the defensive player of the year award, but also the regular season mvp award too.",contingency,because,mid,"i guess i am tough on him because people always say that he should not just win the defensive player of the year award, but also the regular season mvp award too.",That's not his fault! He's only a defensive end and can't control the game like a quarterback.
well aaron rodgers threw 38 touchdowns that season with only 5 interceptions ,led the packers to first in the nfc north with a 12-4 record.,expansion,and,mid,well aaron rodgers threw 38 touchdowns that season with only 5 interceptions and led the packers to first in the nfc north with a 12-4 record.,"Again, that's not his fault. Look at those ridiculous stats and tell me that he shouldn't have been MVP that season."
