arg1,arg2,relation,connective,type,original_utt,original_utt_prev
he could be the next one as well though its tough ,he has the best line and rb in the league.,contingency,because,mid,he could be the next one as well though its tough because he has the best line and rb in the league.,How about Dak Prescott?
"no, he had three games over 200 yards, ",only one other game over 100 yards.,comparison,but,mid,"no, he had three games over 200 yards, but only one other game over 100 yards.","But it wasn't all good for him, was it?"
"probably not, ",they have training camp to show what they can do.,comparison,but,mid,"probably not, but they have training camp to show what they can do.",Anyone of note in the other guys?
"that's true, ",i still think they overpaid for him.,comparison,but,mid,"that's true, but i still think they overpaid for him.",He is young enough that he can still come out on top.
"i was thinking that too, ",he's all the bill's got,comparison,but,mid,"i was thinking that too, but he's all the bill's got","That's true, but I still think they overpaid for him."
that may be ,he won't be getting as big of an offer.,comparison,but,mid,that may be but he won't be getting as big of an offer.,If he keeps starting he'll be noticeable enough for future drafts.
"pretty tough to do, ","a game with three here and there, and possible.",comparison,but,mid,"possibly. that's one and a half a game. pretty tough to do, but a game with three here and there, and possible.",Wonder if he will go for 25 or more touchdowns.
i would be a little wary of picking those two ,"they seem like one year wonders, especially on a team like miami or arizona.",contingency,because,mid,"i would be a little wary of picking those two because they seem like one year wonders, especially on a team like miami or arizona.",There is Jay Ajayi from Miami and David Johnson from Arizona.
"i haven't see, ",i'm guessing the patriots.,comparison,but,mid,"i haven't see, but i'm guessing the patriots.",Who is the favorite to win the Super Bowl this year?
"he seemed like he'd be good, ",i think he has confidence issues in the pocket.,comparison,but,mid,"he seemed like he'd be good, but i think he has confidence issues in the pocket.",It sure was.  I think Houston will be better this year now that Osweiler is gone.
"i know, ",i think money was a problem.,comparison,but,mid,"i know, but i think money was a problem.  romo calling nfl games should be interesting.",Houston has a great defense and just neede and experience QB.
"he does college basketball too, ",i think he is best doign the nfl games.,comparison,but,mid,"he does college basketball too, but i think he is best doign the nfl games.",Don't forget the Masters!
"it was said on espn, bleacherreport, and nfl.com ",i would believe it.,contingency,so,mid,"it was said on espn, bleacherreport, and nfl.com so i would believe it.",Where did you hear that I think that's absurd?
alot of people who bought the card received autograph cards from dak prescott ,they got redemptions in the pack of cards.,contingency,because,mid,alot of people who bought the card received autograph cards from dak prescott because they got redemptions in the pack of cards.,I'm wondering how the card companies are going to fix this problem with Prescott?
"i was looking at more of the off-the-field issues, ",interesting to know what they will do on the field as well.,comparison,but,mid,"i was looking at more of the off-the-field issues, but interesting to know what they will do on the field as well.","In terms of the game, or their off the field issues?"
we sat way up in a nose bleed section ,i didn't care.,comparison,but,mid,"tell me about it. they were cheap, too. we sat way up in a nose bleed section but i didn't care.",Same day tickets? That's a thing of the past.
i read that online ,it was a false story.,comparison,but,mid,i read that online but it was a false story.,Hey i heard that Ben Rothensberger had lost several fingers in a fourth of July fireworks accident.
why is that?,they have the most losses or what ?,contingency,because,begin,why is that? because they have the most losses or what ?,Well I think the Raiders  really have not been popular for a while
i agree.,have you been to one of their games?,comparison,but,begin,i agree. but have you been to one of their games?,It just seems that they haven't been too popular
i think brady is a great quarterback ,peyton is my man.,comparison,but,mid,i think brady is a great quarterback but peyton is my man.,You think he is better than Tom Brady?
peyton is great ,he isn't clutch.,comparison,but,mid,peyton is great but he isn't clutch.,"Really, why Tom over Peyton."
"the colts defense was always ranked high, ",we weren't that good.,comparison,but,mid,"the colts defense was always ranked high, but we weren't that good.",Do you think Peyton needed more help in Indianapolis?
"it started out promising, ",the guy was just too stubborn in his methods.,comparison,but,mid,"it started out promising, but the guy was just too stubborn in his methods.",I think he was the worst coach in Philadelphia Eagle's history.
at the time he could be infuriating ,it was always interesting.,comparison,but,mid,at the time he could be infuriating but it was always interesting.,I am nostalgic for the Buddy Ryan years.
i admit he is good.,", there are better players",comparison,but,begin,"i admit he is good. but, there are better players",I think he has won quite a few
I have to admit it,", tom brady is the best",comparison,but,begin,"but, tom brady is the best",He was good. I have to admit it
"donating money is great, of course, ",seeing players out there volunteering is pretty awesome,comparison,but,mid,"donating money is great, of course, but seeing players out there volunteering is pretty awesome","Speaking of players and their wives, I see a lot about Eli Manning and his wife making pretty sizeable donations"
"i don't know, ",i hope that they do so he brings some of that positivity to san francisco,comparison,but,mid,"i don't know, but i hope that they do so he brings some of that positivity to san francisco",Do you think they'll trade him to the 49ers like the rumors have been saying?
"you don't really see offensive linemen being super popular like that, ",it's a nice change of pace,contingency,so,mid,"you don't really see offensive linemen being super popular like that, so it's a nice change of pace",They have a pretty nice guy too in Joe Staley; he's a character
jerry jones gets a bad reputation ,of his crazy actions as gm during the late 1990s and 2000s.,contingency,because,mid,"jerry jones gets a bad reputation because of his crazy actions as gm during the late 1990s and 2000s. however, his focus on drafting a strong offensive line demonstrates how he has begun to mature as a gm.",Are you seriously contending that the Jerry Jones-owned and operated Cowboys exhibit organizational strength?
"i acknowledge that dez being late to meetings was a major issue in the past, ",they're working to solve it.,comparison,but,mid,"i acknowledge that dez being late to meetings was a major issue in the past, but they're working to solve it. however, it is undeniable that in recent years, they have drafted the best offensive line, the best running back, and the best young quarterback in football.",The Dallas Cowboys is an organization that allows Dez Bryant to be late to or miss numerous meetings per year. How is that a strong organization?
eli manning has led the league in interceptions on numerous occasions.,"he's a two-time super bowl mvp, both were very fluky.",comparison,although,begin,"eli manning has led the league in interceptions on numerous occasions. although he's a two-time super bowl mvp, both were very fluky.",That's ridiculous! There is no way he is better than Eli Manning.
he won his first super bowl off a crazy helmet catch from david tyree and won the second super bowl ,wes welker dropped a pass.,contingency,because,mid,i have no problem referring to his wins as flukes. he won his first super bowl off a crazy helmet catch from david tyree and won the second super bowl because wes welker dropped a pass.,"It's hard to consider his Super Bowl wins flukes when he did it against Tom Brady, arguably the greatest quarterback ever, both times."
he won his first super bowl off a crazy helmet catch from david tyree ,won the second super bowl because wes welker dropped a pass.,expansion,and,mid,i have no problem referring to his wins as flukes. he won his first super bowl off a crazy helmet catch from david tyree and won the second super bowl because wes welker dropped a pass.,"It's hard to consider his Super Bowl wins flukes when he did it against Tom Brady, arguably the greatest quarterback ever, both times."
"that's true, ",it's too bad he was a slapper of people.,comparison,but,mid,"that's true, but it's too bad he was a slapper of people.",Amazing.  He just left no stone unturned in his quest to be the best athlete he could.
"well they did cheat with, you all's quarterback got caught cheating deflating balls, ",they'd be easier to catch.,contingency,so,mid,"well they did cheat with, you all's quarterback got caught cheating deflating balls, so they'd be easier to catch.","Oh, no, not that again!"
"well i also got a second house in the san francisco area, ",i'm a 49ers fan too.,contingency,so,mid,"well i also got a second house in the san francisco area, so i'm a 49ers fan too.",I thought you were a Pats fan.
"you bet, i get all these teams to choose from ",i have homes in many different cities.,contingency,because,mid,"you bet, i get all these teams to choose from because i have homes in many different cities.",Well then good for you.
"i agree, ",that's over for him.,comparison,but,mid,"i agree, but that's over for him. he is back in the black and gold and i think he is going to have a breakout year.",Seems like they would work more with the guys that have problems instead of ostracizing them.
I'm planning on watching him take this team to the super bowl.,you are telling me there is a chance.,contingency,so,begin,so you are telling me there is a chance.,"Oh my goodness, I certainly hope so. I'm planning on watching him take this team to the super bowl."
i definitely will not say the name of the team that has tom brady as its quarterback ,that is the team the steelers must be able to beat.,expansion,and,mid,o.k. i definitely will not say the name of the team that has tom brady as its quarterback and that is the team the steelers must be able to beat.,Don't even mention their name.
Tell me why,"if it comes short, the ball is still live and the opposing team can return it.",contingency,because,begin,"because if it comes short, the ball is still live and the opposing team can return it.",Oh here we go. Tell me why
i think he will improve their offense ,not enough to make a playoff run.,comparison,but,mid,i think he will improve their offense but not enough to make a playoff run.,Do you think Adrian Peterson will be effective in New Orleans
im guessing the packers will ,if the vikings can get better and be more consistent i could see them making a run for it,comparison,but,mid,im guessing the packers will but if the vikings can get better and be more consistent i could see them making a run for it,Who do you think will win the NFC North?
im guessing the packers will but if the vikings can get better ,be more consistent i could see them making a run for it,expansion,and,mid,im guessing the packers will but if the vikings can get better and be more consistent i could see them making a run for it,Who do you think will win the NFC North?
they have a lot of good pieces ,i dont know if they can get more than 4 wins this year.,comparison,but,mid,they have a lot of good pieces but i dont know if they can get more than 4 wins this year.,Will the Browns be any good this year?
they could outscore them with their offensive skilled players ,im not sure the defense can stop tom brady,comparison,but,mid,they could outscore them with their offensive skilled players but im not sure the defense can stop tom brady,Will the dolphins be able to upset the Patriots this year?
i plan on watching all the vikings games ,after that im not too sure.,comparison,but,mid,i plan on watching all the vikings games but after that im not too sure.,How many games do you plan on watching?
i think he will get better ,the competition will be much better so im not sure his stats will improve much.,comparison,but,mid,i think he will get better but the competition will be much better so im not sure his stats will improve much.,Will Dak Prescott improve his game this year?
"i am a cowbiys fan, ",i worry they might have a down year.,comparison,but,mid,"i am a cowbiys fan, but i worry they might have a down year.",What is youtr favorite team?
"i honrstly don't think the patriots will win again, ",they will be good.,comparison,although,mid,"i honrstly don't think the patriots will win again, although they will be good. i think it may be some long shot.",Well I wish you the best of luck with them. Whao you think will win the Super Bowl.
i don't know if that might have been ,they coached when we were growing up though.,contingency,because,mid,i don't know if that might have been because they coached when we were growing up though.,"Yeah, I was thinking him and Jim Mora."
"it could be, ",they both did pretty decently.,comparison,but,mid,"it could be, but they both did pretty decently.",I don't know if that might have been because they coached when we were growing up though.
"i'm not saying that he's not talented, ",his first three super bowls had more to do with a dominant defense than brady's play at quarterback.,comparison,but,mid,"i'm not saying that he's not talented, but his first three super bowls had more to do with a dominant defense than brady's play at quarterback.",You're not giving Brady enough credit. You don't win five Super Bowls without having immense talent.
let us not forget that aaron rodgers had just completed an improbable eight-game winning streak ,had lost his leading receiver jordy nelson to injury two games prior.,expansion,and,mid,"that is true, but incomplete. let us not forget that aaron rodgers had just completed an improbable eight-game winning streak and had lost his leading receiver jordy nelson to injury two games prior.","All I know is that last season, Brady led the greatest comeback in Super Bowl history against the Atlanta Falcons while Aaron Rodgers collapsed against them in the NFC Championship Game."
"i think that he's the best quarterback not just currently, ",of all time.,comparison,but,mid,"i think that he's the best quarterback not just currently, but of all time. however, if i were to start a team right now, i would pick andrew luck just based on age.",Let's agree to disagree. So I guess based on your previous comments that you think that Brady is the best quarterback in the NFL right now.
brees has literally done nothing ,throw the ball in new orleans.,comparison,but,mid,brees has literally done nothing but throw the ball in new orleans.,Yeah but hes young and hes playing in a time when passing is the name of the game.
"me neither, ",he never gets hurt and has the weapons around him,comparison,but,mid,"me neither, but he never gets hurt and has the weapons around him",Its interesting but I cant see Ryan throwing for 5000 yards ever.
i know he had a great year ,shannahan is not his coordinator anymore,comparison,but,mid,i know he had a great year but shannahan is not his coordinator anymore,"Me neither, but he never gets hurt and has the weapons around him"
they got a quarterback in the draft ,he is not a premier player.,comparison,but,mid,they got a quarterback in the draft but he is not a premier player.,"I agree, that has been their weakness."
"tickets are not very affordable, ",maybe we could see a few games.,comparison,but,mid,"tickets are not very affordable, but maybe we could see a few games.",I can't remember the last time I was at a game.
"yea, he was fired rather quickly i thought.",dirk koetter seems to have been a great replacement.,comparison,although,begin,"yea, he was fired rather quickly i thought. although dirk koetter seems to have been a great replacement.",They sure did not seem to give Lovie Smith much of a chance to be successful there.
i just think he is an amazing football player ,he is a crappy person.,comparison,but,mid,me apparently. i just think he is an amazing football player but he is a crappy person.,Who doesn't like Payton Manning?
so was the nation ,"instead of letting his brother bask in that glory and allowing him to celebrate his accomplishment, payton made it all about him.",comparison,but,mid,"so was the nation but instead of letting his brother bask in that glory and allowing him to celebrate his accomplishment, payton made it all about him.",It was and I was glad to see he won.
so was the nation but instead of letting his brother bask in that glory ,"allowing him to celebrate his accomplishment, payton made it all about him.",expansion,and,mid,"so was the nation but instead of letting his brother bask in that glory and allowing him to celebrate his accomplishment, payton made it all about him.",It was and I was glad to see he won.
"buffalo changed to their iconic red helmets not only because they were badass, ",because quarterback joe ferguson was color blind.,comparison,but,mid,"buffalo changed to their iconic red helmets not only because they were badass, but because quarterback joe ferguson was color blind. so with four teams in the afc east having white helmets at the time (pats, dolphins, bills, colts), ferguson was struggling to separate receivers from defenders.",What is an interesting fact about your team that most people don't know?
buffalo changed to their iconic red helmets not only ,"they were badass, but because quarterback joe ferguson was color blind.",contingency,because,mid,"buffalo changed to their iconic red helmets not only because they were badass, but because quarterback joe ferguson was color blind. so with four teams in the afc east having white helmets at the time (pats, dolphins, bills, colts), ferguson was struggling to separate receivers from defenders.",What is an interesting fact about your team that most people don't know?
"buffalo changed to their iconic red helmets not only because they were badass, but ",quarterback joe ferguson was color blind.,contingency,because,mid,"buffalo changed to their iconic red helmets not only because they were badass, but because quarterback joe ferguson was color blind. so with four teams in the afc east having white helmets at the time (pats, dolphins, bills, colts), ferguson was struggling to separate receivers from defenders.",What is an interesting fact about your team that most people don't know?
"no disrespect for fat rob, i like him too and believe he has starter ability; ",perine was my favourite back going into this past draft so i really want him to succeed.,comparison,but,mid,"i really hope he wins out. no disrespect for fat rob, i like him too and believe he has starter ability; but perine was my favourite back going into this past draft so i really want him to succeed.",When Will Samaje Perine Take Over As The Lead RB For The Redskins?
what do you think are the biggest rivalries outside of their division ,within their same conference?,comparison,but,mid,what do you think are the biggest rivalries outside of their division but within their same conference?,Las Vegas Chargers has a nice ring to it.
which great teams are forgotten ,they were overshadowed by really epic teams?,contingency,because,mid,which great teams are forgotten because they were overshadowed by really epic teams?,"uhhh, does an interception off a foot count as a gadget play?"
"the bengals seem to be right on the cusp, ",haven't broken through yet.,comparison,but,mid,"the bengals seem to be right on the cusp, but haven't broken through yet.",That was a great dance.  He is a Bengals legend.
i guess you can say that.,"still, there's a lot of jobs out there that are physically risky where they don't get paid as much as athletes.",comparison,but,begin,"i guess you can say that. but still, there's a lot of jobs out there that are physically risky where they don't get paid as much as athletes.","Not really. I think considering how much punishment they put their bodies through, I think it's fair."
these football players are getting paid a lot ,"the nfl makes so much money, too.",contingency,because,mid,"i think it's not that simple. these football players are getting paid a lot because the nfl makes so much money, too.","But there has to be a point where the individual's themselves realize that they're signing up for the risk. Like I said, there are a lot of other jobs that are dangerous, too."
"yes, to some degree.",getting paid millions of dollars to play a game a few times a year is absurd.,comparison,but,begin,"yes, to some degree. but getting paid millions of dollars to play a game a few times a year is absurd.",You don't think the football players should get some of that money if they're putting their bodies on the line for a more entertaining product?
they makes so much money ,the fans continue to pay to watch the sport.,contingency,because,mid,"the way i see it, if the nfl can afford to pay them their salaries they should do it. they makes so much money because the fans continue to pay to watch the sport.","Yes, to some degree. But getting paid millions of dollars to play a game a few times a year is absurd."
i think brady didn't say much ,he had a chip on his shoulder all season for the last couple of years.,comparison,but,mid,i think brady didn't say much but he had a chip on his shoulder all season for the last couple of years.,That's a team you don't want to give an edge to.
he didn't need any extra motivation ,they gave it to him.,comparison,but,mid,he didn't need any extra motivation but they gave it to him.,I think Brady didn't say much but he had a chip on his shoulder all season for the last couple of years.
"i know, ",this year might be the year they get things together.,comparison,but,mid,"i know, but this year might be the year they get things together.",They'er always so bad!!!
"well, they do have some talent, ",probably not enough.,comparison,but,mid,"well, they do have some talent, but probably not enough.","I agree, their coaching staff will have to put in a lot of work."
"i agree that it might be another building year, ",they have some pieces to work with.,comparison,but,mid,"i agree that it might be another building year, but they have some pieces to work with.","Well, they do have some talent, but probably not enough."
"i agree, ",given a clean slate of health - the browns may surprise some people.,comparison,but,mid,"i agree, but given a clean slate of health - the browns may surprise some people.","Yes, and luck plays a pretty big factor in team success."
i'm a ryan and newton fan myself ,what about prescott and manning?,comparison,but,mid,i agree! i'm a ryan and newton fan myself but what about prescott and manning? nfc east has a nice lineup as well.,In my opinion there's no debate in the No. 1 spot. NFC South's QB quartet is in a league of its own right now.
The two-time Super Bowl MVP is tough and clutch and still great.,"brees, he's canton bound ... yet still terrorizing defenses in his late 30s.",comparison,but,begin,"but brees, he's canton bound ... yet still terrorizing defenses in his late 30s.",Eli Manning is Eli Manning. The two-time Super Bowl MVP is tough and clutch and still great.
"that's what i hear, ","my friends are i haven't been to it yet, so i can only go by what i see on tv",comparison,but,mid,"that's what i hear, but my friends are i haven't been to it yet, so i can only go by what i see on tv",The new Vikings stadium seems to be pretty popular
"that's what i hear, but my friends are i haven't been to it yet, ",i can only go by what i see on tv,contingency,so,mid,"that's what i hear, but my friends are i haven't been to it yet, so i can only go by what i see on tv",The new Vikings stadium seems to be pretty popular
"they're playing in green bay this week, ","it will definitely be in an open stadium, have you heard what the weather is going to be like?",contingency,so,mid,"they're playing in green bay this week, so it will definitely be in an open stadium, have you heard what the weather is going to be like?","That's what I hear, but my friends are I haven't been to it yet, so I can only go by what I see on TV"
"oh for sure, ",it's just child play for them now.,comparison,but,mid,"oh for sure, but it's just child play for them now.",Bellicheck and Brady can handle the game.
"very true, ",fear an old man in a place where men die young.,comparison,but,mid,"very true, but fear an old man in a place where men die young.","These guys are getting older, and the younger teams seem to be really hungry."
"that is a strange analogy, ",i kind of understand.,comparison,but,mid,"that is a strange analogy, but i kind of understand.","Very true, but fear an old man in a place where men die young."
i do too ,"they need to start them,",comparison,but,mid,"i do too but they need to start them,","I like their draft picks,"
"true, you know they are not going anywhere this year ",the rookies need experience,comparison,but,mid,"true, you know they are not going anywhere this year but the rookies need experience","I do too but they need to start them,"
"me too, they get old, ",i do like prescott,comparison,but,mid,"me too, they get old, but i do like prescott","Me too, I also hate seeing the Cowboys and Greenbay every Sunday on TV"
Their OL was okay.,they had no receiving help.,comparison,but,begin,but they had no receiving help.,What do you mean nothing?  Their OL was okay.
